,names,keyword,prices,urls,images,ments
0,브라운 오리지널 플러스 저자극 아기물티슈 캡형 80매 10팩,물티슈,18330,https://link.coupang.com/a/mEezS,thumbnail8.coupangcdn.com/thumbnails/remote/230x230ex/image/retail/images/7884930417729115-06aad847-7a0b-42be-9bd0-e7cad31b6fd3.jpg,"브라운 오리지널 플러스 저자극 아기물티슈 캡형 80매 10팩솔직후기’를 출시했다.
이번 제품은 신생아부터 성인까지 사용할 수 있는 제품으로 기존 물티에센스보다 흡수력이 2배 이상 높은 것이 특징이다.
또한 유아용 기저귀와 달리 아기의 체내에 직접 닿는 순간 바로 흡수가 가능해 영유아들의 성장발달에 도움을 준다.
특히, 이번에 출시한 ‘프리미엄 베이비케어’는 천연 유래 성분을 함유하여 민감한 피부에도 안심하고 사용 가능하다.
천연유래 성분인 프리바이오틱스를 함유한 100% 순면커버로 자극 없이 산뜻하게 마사지할수 있다.
뿐만 아니라 아이의 피부에 자극이 없는 무자극 원단을 사용해 민감성 피부를 위한 보습과 영양을 강화했다.
제품은 전국 백화점 및 온라인몰에서 구매가 가능하며, 가격은 1만원대다.</d> 한국은행이 기준금리를 연 1.25%로 동결했습니다.
한은 금융통화위원회는 오늘(22일) 정례회의를 열고 지난달 금통위 의사록을 통해"
1,도담이 트렌디55 엠보싱 유아물티슈 캡형 10팩 80매,물티슈,13900,https://link.coupang.com/a/MEQus,thumbnail10.coupangcdn.com/thumbnails/remote/230x230ex/image/retail/images/2023/01/09/14/0/a1a91dc7-c7f7-4f15-b028-194652fb39da.jpg,"도담이 트렌디55 엠보싱 유아물티슈 캡형 10팩 80매솔직후기’를 출시했다.
이번 제품은 ‘아이들이 좋아하는 아기 물놀이 용품’이라는 콘셉트로 제작됐다.
유아용품은 물론 기저귀, 장난감, 칫약 등 다양한 육아용품까지 다양하게 구성돼 있다.
특히 이번 신제품은 신생아부터 성인기까지 사용할 수 있는 제품으로 아이의 성장에 맞춰 선택할 수도 있어 엄마들의 만족도가 높다.
또한 유모차나 카시트도 함께 구매할 경우 최대 50% 할인된 가격에 구입할수 있다.</d> 한국토지주택공사(LH)는 지난해 말 기준 전국 미분양 주택 총 1만8천9백여가구를 대상으로 조사한 결과 이같이 나타났다고 밝혔습니다.
미분양이 가장 많은 지역은 서울(28%)으로 집계됐고 이어 경기(16%), 인천(12%) 순이었습니다..
수도권은 경기도와 세종시가 각각 6%, 7%로 뒤를 이었습니다
. 특히 수도권에서는 김포 한강신도시에서 분양한 '래미스원'이"
2,탐사 클래식 물티슈 캡형 100매 20팩,물티슈,15560,https://link.coupang.com/a/MEQva,thumbnail10.coupangcdn.com/thumbnails/remote/230x230ex/image/retail/images/436314960169675-7d07cfe9-db8d-4489-a637-c94000037e0c.jpg,"탐사 클래식 물티슈 캡형 100매 20팩솔직후기’를 출시했다.
이 제품은 ‘물탱크’ 기능을 통해 물에 젖어도 물이 스며들지 않고 그대로 흡수되는 것이 특징이다.
또한 물을 분사해 수분을 증발시켜주는 ‘수분투과 시스템’을 적용, 수분 손실을 최소화했다.
특히 이 제품에는 기존 제품에 비해 약 30% 더 많은 양의 수분이 함유돼 있어 피부 자극을 최소화 했다.
아울러 아토피피부염에 효과적인 천연성분인 ‘아쿠아리움’과 항균 및 탈취 효과가 있는 ‘오일프리미엄’이 함유되어 있다.
이와 함께 롯데홈쇼핑은 오는 30일까지 홈앤스토리몰에서 구매고객을 대상으로 추첨으로 총 50명에게 아이패드 미니(1명), 스타벅스 아메리카노 기프트(20명)를 증정한다.
CJ오클락 관계자는 “최근 미세먼지와 황사 등으로 인해 실내 공기질이 악화되면서 고객들의 건강을 위해 다양한 제품을 선보이고 있다”며 “이번 신제품 출시를"
3,코멧 아기물티슈 오리지널 캡형 100매 10팩,물티슈,11390,https://link.coupang.com/a/MEQv1,thumbnail6.coupangcdn.com/thumbnails/remote/230x230ex/image/retail/images/1674530736104201-5147eb54-a476-4c53-b97a-212cc8226b4e.jpg,"코멧 아기물티슈 오리지널 캡형 100매 10팩솔직후기’를 출시했다.
이번 제품은 신생아부터 성인까지 사용할 수 있는 제품으로 아기의 피부 보호막을 형성해 주는 것이 특징이다.
아기 물티는 유아용 기저귀, 분유 등 다양한 육아 용품을 함께 구매할 경우 추가적인 사은품도 받을수 있다.
또한 ‘아이맘 안심케어’ 서비스는 영유아의 아토피피부염 및 알레르기 비염, 천식 등의 증상을 완화시켜주는 기능성 화장품이다.
‘안심 케어(Animal Care)’는 아이의 피부에 직접 닿는 모든 제품을 대상으로 한 서비스로, 아이에게 필요한 화장품과 영양제를 제공한다.
특히 이번에 출시한 ‘아임페이스’는 민감해진 피부를 진정시키고 촉촉하게 가꿔준다.
뿐만 아니라 민감한 피부의 가려움증을 개선해 줄 뿐만 아니라, 보습과 자외선 차단 기능을 동시에 갖춘 프리미엄 안티에이징 라인으로, 특히 예민하고 건조한 피부와 모공 속 노폐물을 효과적으로 제거해준다.
이와함께 롯데홈쇼핑"
4,루이비앙 핑크 저자극 엠보싱 아기물티슈 캡형 100매 10팩,물티슈,15800,https://link.coupang.com/a/MEQwR,thumbnail10.coupangcdn.com/thumbnails/remote/230x230ex/image/retail/images/5383088822576826-f5f9d965-7236-4816-b30e-d782037399b0.jpg,"루이비앙 핑크 저자극 엠보싱 아기물티슈 캡형 100매 10팩솔직후기’를 진행한다.
이번 이벤트는 오는 31일까지 진행된다.
자세한 내용은 공식 홈페이지에서 확인할 수 있다.</d> 지난해 12월 말 기준 국내 은행의 원화대출 연체율은 1.9%로 전년 동월 대비 0.06%포인트 상승했다.
이는 글로벌 금융위기 이후 가장 높은 수준이다.
은행권 전체로는 2016년 11월(1.9%)부터 올 1월(0.7%), 2월(2.61%, 3월) 등 3개월 연속 하락세를 이어가고 있다.
연체율이란 은행이 대출을 갚지 못해 생긴 부실채권을 말한다.
금융감독원은 은행들이 연말 결산 때 대손충당금을 적립하지 않고 쌓아두는 것을 막기 위해 이 같은 조치를 취했다고 설명했다.
금감원 관계자는 ""대규모 충당금이 쌓이면 건전성이 악화될 우려가 있다""며 ""이런 경우엔 경영개선계획 이행 여부를 점검할 것""이라고 말했다.
한편 금리는 기업 구조조정 여파로 소폭 올랐다.
"
5,도담이 저자극 소프트 플레인 유아 물티슈 캡형 100매 10팩,물티슈,11930,https://link.coupang.com/a/MEQxE,thumbnail9.coupangcdn.com/thumbnails/remote/230x230ex/image/retail/images/16984895451097-863012c0-8ff0-4829-a3b0-04efacbce6fd.jpg,"도담이 저자극 소프트 플레인 유아 물티슈 캡형 100매 10팩솔직후기’를 출시했다.
이번 제품은 ‘물놀이 후유증’을 예방하기 위해 물에 젖지 않도록 하는 것이 가장 중요하다는 점에 착안해 개발된 제품이다.
특히, 이번에 출시한 100% 천연원료 베이비 원단을 사용해 아기 피부에 자극이 없는 안전한 제품을 선보인다.
또한 신생아부터 성인까지 사용할 수 있는 전용 파우치도 함께 구성돼 있어 아이의 피부 고민에 따라 선택할 수도 있다.
아기용 기저귀와 분유, 이유식 등 다양한 용품을 한 번에 구매할 때 보다 합리적인 가격으로 구입할 수가 있다는 점도 장점이다.
제품은 전국 주요 백화점 및 온라인 쇼핑몰에서 만나볼수 있다.</d> 한국은행이 기준금리를 연 1.25%로 동결했습니다.
한은 금융통화위원회는 오늘(22일) 정례회의를 열고 지난달 금통위 의사록을 통해 ""국내 경제는 수출과 설비투자 증가세가 둔화됐으나 소비는 완만한 회복세를 지속하고 있다""며 이같이 결정"
6,탐사 클래식 물티슈 캡형 100매 10팩,물티슈,8680,https://link.coupang.com/a/MEQyB,thumbnail7.coupangcdn.com/thumbnails/remote/230x230ex/image/retail/images/164153445891991-af0d5790-2402-4a6d-95d6-25a2bbd579d1.jpg,"탐사 클래식 물티슈 캡형 100매 10팩솔직후기
#20190413 <unk>korea.kr</d> 오늘은 내일도 화이팅!!
오늘의 포스팅을 마무리하고 싶다면 이번에 소개해드릴게요~^^ 
이번엔 제가 직접 만든 제품으로 만들어봤어요
저희집에도 이런 제품이 있었으면 좋겠어요.
저는 요즘 매일매일 아침마다 이렇게 열심히 일하고 있어요.
그런데 저는 항상 아침에 일어나서 일을 하고 있거든요.
그래서, 하루종일을 앉아서 일하는데도
아침에 일어나는 시간이 너무 길었죠.
그러다 보니까, 출근할 때면 늘 피곤한 기분이 들더라고요..
제가 좋아하는 건 바로 이것인데요,
바로 ``오메가3 오메가(OMEA) 성분 함유로 만들어진 건강기능식품이에요.
건강하게 오래 살 수 있는 비결이라고 생각해서
하루 종일, 한 시간씩 꾸준히 섭취하는 것이 중요해요.
특히나 저녁에는 꼭 챙겨먹"
7,바이오늘 프리미엄 소프트 엠보싱 유아물티슈 캡형 10팩 100매,물티슈,12500,https://link.coupang.com/a/MEQzA,thumbnail6.coupangcdn.com/thumbnails/remote/230x230ex/image/retail/images/8328764636376909-6933c691-c62b-459c-9d72-ee681e2d672b.jpg,"바이오늘 프리미엄 소프트 엠보싱 유아물티슈 캡형 10팩 100매솔직후기’를 출시했다.
이번 제품은 기존 제품 대비 약 30% 더 많은 양을 담아 더욱 안전하고 위생적인 물 관리가 가능하다.
또한 신생아부터 성인까지 사용할 수 있는 ‘프리바이오틱스’ 성분을 함유해 민감한 아기 피부를 보호해준다.
아기 전용 세정제 타입으로 구성돼 있어 아기의 피부 상태에 따라 사용 가능하다.</d> 한국토지주택공사(LH)는 지난달 말 기준 전국 미분양 주택은 총 1만2천911가구로 전월(1만475가구)대비 5.5% 감소했다고 1일 밝혔다.
지역별로는 수도권이 1천7152가구로, 전달보다 6.7% 줄었다.
수도권은 2천8161가구, 지방은 3천5363가구가 각각 줄어 지방 중소도시와 수도권 모두에서 소폭 증가했다.
규모별로 85m2 초과 중대형은 7656가구(전체 공급량의 42.9%), 60~83m2의 경우 8995가구를 기록했다.
85m 이하는 435"
8,하기스 퓨어 그린 유아물티슈 캡형 72매 10팩,물티슈,13280,https://link.coupang.com/a/MEQAa,thumbnail7.coupangcdn.com/thumbnails/remote/230x230ex/image/retail/images/1829547173716081-4f4285e7-51e5-41ca-9b8b-040bb6a29238.jpg,"하기스 퓨어 그린 유아물티슈 캡형 72매 10팩솔직후기’를 진행한다.
이번 이벤트는 오는 30일까지 진행된다.
자세한 내용은 홈페이지에서 확인할 수 있다.
한편 ‘퓨리유아 물티는 안전한 제품’이라는 슬로건 아래, 지난해부터 안전하고 믿을만한 제품을 만들기 위해 노력하고 있는 (주)아이비케어는 이번 행사를 통해 고객들에게 보다 안심할수 있도록 다양한 체험 기회를 제공할 예정이다.</d> 한국거래소는 올 들어 코스피200지수 등 지수선물을 하루 평균 거래대금이 1조원을 돌파했다고 2일 밝혔다.
지난달 말 기준 유가증권시장 시가총액은 4조9천억원으로 전월보다 1천억원 늘었다.
코로나19 사태로 인한 경기침체 우려에도 불구하고 주식시장이 상승세를 이어간 것으로 풀이된다.
유가증권시장의 경우 개인투자자의 매수세가 유입되며 2조1000억원, 코스닥시장은 3조2250원 증가했다.
코스탁은 6301계약 순증했다.
개인은 이 기간 동안 총 7206계약을 사"
9,땡큐 물티슈 캡형 100매 20팩,물티슈,12510,https://link.coupang.com/a/MEQBa,thumbnail10.coupangcdn.com/thumbnails/remote/230x230ex/image/vendor_inventory/f0c7/895e8e6cff5273c66e7ae73f5904aba534aa15c213c878d6e5eb34a8cdcc.jpg,"땡큐 물티슈 캡형 100매 20팩솔직후기
#물놀이후유증관리제추천</d> 오늘은 제가 좋아하는 과자랑 빵을 먹었어요.
빵이 너무 맛있어서 저는 그냥 먹고 싶었는데...
그냥 먹는게 아니라 진짜로 맛있는거 같아요.
그래서 이번에 또 먹어봤는데 역시나 달달한 맛이였어요!
그리고 그 위에 치즈도 같이 올려져 있어서 정말 좋았답니다.
치즈가 들어간건 처음인데...ᄏᄒ.ᅲ<unk>!??
아무래도 다른것보다 더 많이 들어있는 것 같아서 좋아요
저는 개인적으로 크림파스타를 주문했는데요,
크림 파테에 찍어먹으면 느끼하지 않고 담백하고 고소해서 넘넘 잘 어울렸답니다~^^ 
저희는 크림을 먼저 시켰고요.^_-;)
제가 먹은 후르츠베리맛의 딸기잼과 함께 먹으면 더욱더 꿀맛이죠, ></// •• -
("
10,브라운 베이직 플러스 저자극 유아물티슈 캡형 102매 10팩,물티슈,14900,https://link.coupang.com/a/MEQCj,thumbnail9.coupangcdn.com/thumbnails/remote/230x230ex/image/retail/images/7802169957881317-3603d5b1-0279-4f76-8de5-899e12917e1a.jpg,"브라운 베이직 플러스 저자극 유아물티슈 캡형 102매 10팩솔직후기’를 출시했다.
이번 제품은 ‘베이비 물통’ 형태의 제품으로 아기 피부에 닿는 순간부터 촉촉하게 흡수되는 것이 특징이다.
또한 신생아용 기저귀, 수유복, 파우치 등 다양한 용도의 제품을 함께 구성해 사용 편의성을 높였다.
아기들이 좋아하는 유모차나 카시트도 간편히 사용할 수 있도록 했다.
유아의 경우 젖병이나 젖꼭지 등을 통해 쉽게 분리 배출할 수도 있다.
특히 아기의 성장 단계에 따라 필요한 영양소를 골고루 섭취하는 것도 중요하다.
유산균과 유산균을 함유한 프리미엄 영유아를 위한 ‘유자몽 멀티비타민’은 생후 6개월에서 12개월까지 매일 아침 우유와 우유를 갈아 마시는 방식으로 아기에게 좋은 건강기능식품이다.
‘프리바이오틱스’는 프로바이오틱스가 함유된 식물성 원료로, 면역력 증진과 피로회복에 도움을 준다.
최근에는 국내 최초로 미국 식품의약국(FDA)으로부터 기능성 원료로 인정받은 바 있는 비타민 B1을 함유"
11,브라운 프리미엄 옐로우 저자극 엠보싱 아기물티슈 캡형 72매 10팩,물티슈,22600,https://link.coupang.com/a/mEezS,thumbnail10.coupangcdn.com/thumbnails/remote/230x230ex/image/retail/images/4162844904229576-8413a04f-92d2-4c49-9fc1-bfd8881311d6.jpg,"브라운 프리미엄 옐로우 저자극 엠보싱 아기물티슈 캡형 72매 10팩솔직후기’를 출시했다.
이번 제품은 신생아부터 성인까지 사용할 수 있는 제품으로 기존 물병보다 용량을 2배 늘렸다.
또한 ‘엠보리쉬’ 원단을 사용해 부드러운 촉감과 보습력을 자랑한다.
아기물은 아기의 피부 속 수분 손실을 막아주는 기능성 소재다.
특히, 이번에 출시한 신제품은 유아용 기저귀와 함께 사용하면 더욱 좋다.
신생아의 경우 성장기에 접어든 아기는 물론 어른도 사용하기에 적합하다.
유모차나 카시트 등 유아가 가지고 다니는 모든 것을 보호할 뿐만 아니라 아이의 성장에 맞춰 다양한 제품을 선택할 수도 있다.
롯데홈쇼핑 관계자는 “최근 출산율이 높아지면서 육아에 대한 관심이 높아지고 있다”며 “이러닝과 홈케어 수요가 증가하면서 관련 상품들이 인기를 끌고 있어 이번 상품을 기획하게 됐다”고 말했다.</d> 한국은행이 기준금리를 연 1.25%로 동결했습니다.
한은 금융통화"
12,베베숲 저자극 센시티브 엠보싱 물티슈 캡형 80매 10팩,물티슈,24250,https://link.coupang.com/a/mEezS,thumbnail8.coupangcdn.com/thumbnails/remote/230x230ex/image/retail/images/3122787206281014-b7045b35-2019-4ef4-b5bf-d8328c64323c.png,"베베숲 저자극 센시티브 엠보싱 물티슈 캡형 80매 10팩솔직후기’를 출시했다.
이번 제품은 ‘물탱크’ 타입으로 기존 제품 대비 약 30% 더 많은 양을 사용할 수 있다.
또한 물에 잘 녹는 특수 코팅을 적용해 피부 자극을 최소화했다.
캡슐은 물과 함께 사용하면 더욱 촉촉하고 부드러운 사용감을 느낄수 있으며 수분 공급과 보습, 영양공급까지 모두 가능하다.
특히 이번에 출시한 ‘수분 크림’은 피부에 빠르게 흡수되는 것이 특징이다.
피부 속 수분이 증발하면서 자연스럽게 녹아내리는 것을 방지해주는 기능성 성분인 '에센셜 오일'을 함유하여 민감한 피부를 위한 세안제로도 손색이 없다.
아울러 에멀전 성분이 함유된 앰플 형태로 구성돼 있어 간편하게 마사지할 수도 있다.</d> 한국관광공사는 지난달 31일부터 한 달간 중국 베이징(北京) 소재 여행사 및 호텔 관계자 등 100여명을 초청해, 서울-상하이 직항노선 취항 기념"
13,페넬로페 본보야지 퐁피두 저자극 아기물티슈 캡형 10팩 70매,물티슈,21900,https://link.coupang.com/a/MEQE2,thumbnail7.coupangcdn.com/thumbnails/remote/230x230ex/image/retail/images/12411916866764891-2a4bf6ce-2e33-49a4-aa14-1d2efd11ddfa.jpg,"페넬로페 본보야지 퐁피두 저자극 아기물티슈 캡형 10팩 70매솔직후기’를 출시했다.
이번 제품은 신생아부터 성인까지 사용할 수 있는 제품으로 유아용 물티, 기저귀, 분유 등 다양한 육아 용품을 함께 구성해 엄마들의 선택의 폭을 넓혔다.
특히 이번 신제품은 ‘엄마들이 가장 좋아하는 베이비케어’ 콘셉트로 엄마의 마음을 사로잡을 예정이다.
‘베이비스타’는 아기의 피부 속 수분 밸런스를 맞춰주는 기능성 화장품이다.
아기물을 통해 모공 수축과 피지 조절에 도움을 주는 것이 특징이다.
또한 아토피, 천식, 비염, 알레르기 등의 면역력 증진에 도움이 되는 성분도 함유돼 있다.
신생아의 경우 성장기에 접어든 아이에게 필요한 영양소를 공급해주는 역할을 한다.
이에 따라 신생아는 물론 영유아를 둔 부모들도 안심하고 사용 할수 있도록 했다.
먼저 ‘아빠가 추천하는 건강한 이유식’은 아기가 태어나면 꼭 챙겨 먹어야 하는 필수 식품"
14,베베앙 오리지널 플러스 아기물티슈 캡형 100매 10팩,물티슈,13980,https://link.coupang.com/a/mEezS,thumbnail6.coupangcdn.com/thumbnails/remote/230x230ex/image/retail/images/7797012972141430-495033ec-71d6-4684-9f08-1ec8e468ccf6.jpg,"베베앙 오리지널 플러스 아기물티슈 캡형 100매 10팩솔직후기’를 출시했다.
이번 제품은 신생아부터 성인까지 사용할 수 있는 제품으로 아기의 피부 타입에 따라 선택할 수도 있다.
아기 물티는 유아용 기저귀로 사용 가능하며 베이비페어 기간 동안 매일 1회씩 증정한다.
또한 ‘베이비스타’ 브랜드의 대표 상품인 ‘아임유니크’는 지난해 11월 출시한 이후 현재까지 누적 판매량 1000만개를 돌파하는 등 큰 인기를 얻고 있다.</d> 한국거래소는 오는 30일 오후 2시 서울 여의도 본사에서 '2019년도 정기주주총회'를 개최한다고 29일 밝혔다.
올해는 코로나19 확산 방지를 위해 주주총회를 연기하고 온라인 화상회의 방식으로 진행될 예정이다.
주총 안건은 ▲이사 선임 및 감사위원회 위원 선임을 위한 정관 변경안▲정관 일부 개정안과 이사 보수한도, 보수 한도 승인 등이다.
한국예탁결제원은 올해도 주총을 비대면 온라인으로 진행할 계획이다.
온라인"
15,페넬로페 프르미에 포레 저자극 아기물티슈 캡형 70매 10팩,물티슈,18330,https://link.coupang.com/a/MEQG1,thumbnail6.coupangcdn.com/thumbnails/remote/230x230ex/image/retail/images/87161316396390-e5fef2b3-f75b-440a-a875-bafedb8cd416.jpg,"페넬로페 프르미에 포레 저자극 아기물티슈 캡형 70매 10팩솔직후기’를 출시했다.
이번 신제품은 신생아부터 성인까지 사용할 수 있는 제품으로 산모와 아기의 건강을 위해 개발된 프리미엄 유아용 물탱크다.
산모가 사용하는 기저귀와 달리 아기가 사용하기 좋은 크기로 제작돼 있어 아이가 안심하고 사용 가능하다.
또한 ‘프리미어’ 브랜드의 대표 상품인 만큼 다양한 육아 용품을 합리적인 가격에 구매할 수도 있다.
아기물을 직접 만져보고 아이의 피부 타입과 취향에 따라 선택할수 있으며 특히 영유아의 경우 유모차나 카시트 등 부피가 큰 제품을 선택하기 어려운 점을 고려해 파우치 형태로 구성해 휴대성을 높였다.
신생아는 물론 성인이 함께 사용하면 더욱 안전하다.
특히, 신생아가 착용하면 보호자 없이도 안전하게 사용이 가능하며 수유 시에도 간편하게 이용할 수가 있다.</d> 한국은행이 기준금리를 연 1.25%로 동결했습니다.
한은 금융통화위원회는 오늘(22일) 정례회의를 열고 이달"
16,코멧 저자극 시그니처 아기 물티슈 엠보싱 캡형 100매 10팩,물티슈,12790,https://link.coupang.com/a/MEQIa,thumbnail7.coupangcdn.com/thumbnails/remote/230x230ex/image/retail/images/5683389351774-49602307-9b8a-4eae-841f-9030b9e70708.jpg,"코멧 저자극 시그니처 아기 물티슈 엠보싱 캡형 100매 10팩솔직후기’를 진행한다.
이번 이벤트는 오는 31일까지 진행된다.
엠보이 공식 페이스북을 통해 진행되는 이번 이벤트에서는 ‘물 티슈는 언제 어디서나 간편하게 사용할 수 있는 제품’이라는 콘셉트로 제품을 구매한 후 해시태그로 해당 제품의 사진을 업로드하면 추첨으로 총 50명에게 아이패드 미니(1명), 스타벅스 아메리카노 기프콘(50명)을 증정할 예정이다.
또한, 이달 말까지 네이버 스마트스토어에서 '#MB필수템' 검색창에 롯데마트, 홈플러스, GS25, CU 등 주요 편의점 브랜드를 입력하고 응모하는 고객 중 선착순 500명을 대상으로 최대 1만원 할인쿠폰도 제공한다.
당일 당일에만 사용 가능한 쿠팡 로켓배송 상품은 행사 기간 동안 매일 오전 11시부터 오후 6시까지 배송된다.
자세한 내용은 홈페이지를 참고하거나 가까운 매장을"
17,코멧 아기물티슈 오리지널 캡형 100매 10팩,물티슈,11390,https://link.coupang.com/a/MEQI5,thumbnail6.coupangcdn.com/thumbnails/remote/230x230ex/image/retail/images/1674530736104201-5147eb54-a476-4c53-b97a-212cc8226b4e.jpg,"코멧 아기물티슈 오리지널 캡형 100매 10팩솔직후기’를 출시했다.
이번 제품은 신생아부터 성인까지 사용할 수 있는 제품으로 아기의 피부 보호막을 형성해 주는 것이 특징이다.
아기 물티는 유아용 기저귀, 분유 등 다양한 육아 용품을 함께 구매할 경우 추가적인 사은품도 받을수 있다.
또한 ‘아이맘 안심케어’ 서비스는 영유아의 아토피피부염 및 알레르기 비염, 천식 등의 증상을 완화시켜주는 기능성 화장품이다.
‘안심 케어(Animal Care)’는 아이의 피부에 직접 닿는 모든 제품을 대상으로 한 서비스로, 아이에게 필요한 화장품과 영양제를 제공한다.
특히 이번에 출시한 ‘아임페이스’는 민감해진 피부를 진정시키고 촉촉하게 가꿔준다.
뿐만 아니라 민감한 피부의 가려움증을 개선해 줄 뿐만 아니라, 보습과 자외선 차단 기능을 동시에 갖춘 프리미엄 안티에이징 라인으로, 특히 예민하고 건조한 피부와 모공 속 노폐물을 효과적으로 제거해준다.
이와함께 롯데홈쇼핑"
18,깨끗한나라 페퍼민트 물티슈 캡형 70매 10팩,물티슈,12970,https://link.coupang.com/a/MEQKx,thumbnail7.coupangcdn.com/thumbnails/remote/230x230ex/image/retail/images/7973525010261227-985afd1b-e51a-433e-92f4-39c3b298fe1c.png,"깨끗한나라 페퍼민트 물티슈 캡형 70매 10팩솔직후기’를 출시했다.
이 제품은 ‘페퍼가족 수딩젤’ 제품으로 피부에 닿는 순간 촉촉하고 부드러운 젤 타입의 수분감이 특징이다.
또한 피부 속부터 보습막을 형성해 피부를 보호해주는 것이 특징. 특히 이 제품의 가장 큰 특징은 바로 건조함이다.
건조함을 유발하는 유해산소를 99.9% 제거해 주는 것은 물론 산뜻하게 마무리해준다.
특히, 건조한 피부는 수분이 부족할 경우 각질층이 두꺼워지면서 모공이 확장돼 피부가 쉽게 거칠어지고 트러블을 일으킬 수도 있다.
이에 따라 저자극성 세정제 사용으로 민감한 피부의 유수분 밸런스를 맞춰주는 것도 중요하다.
피부에 자극이 가지 않도록 천연 계면활성제를 사용해 부드럽게 닦아낸 후 사용하면 된다.
아울러, 아토피, 여드름 등 민감해진 부위에 사용할 때는 오일프리 제품을 사용하는 게 좋다.
오일 프리 성분은 자극 없이 순하면서 끈적임 없는 사용감을 선사한다.
여기에 오일을 바른 후에는 물기가"
