,names,keyword,prices,urls,images,ments
177,(3종세트) 유아 설빔 남아 여아 한복세트 아동 복주머니 목도리 아기 한복 바지 치마,아기한복,44900,https://link.coupang.com/a/MES61,thumbnail9.coupangcdn.com/thumbnails/remote/230x230ex/image/vendor_inventory/3cb9/3de6df390a230bc1c42ab4e4f548cc259c14c042f4935a8ad95cd0db1072.png,"(3종세트) 유아 설빔 남아 여아 한복세트 아동 복주머니 목도리 아기 한복 바지 치마솔직후기 등 다양한 이벤트를 진행한다.
또한 오는 30일까지 ‘설맞이 선물 대잔치’를 열고 롯데백화점 전점에서 5만원 이상 구매고객을 대상으로 추첨해 백화점의 상품권을 증정하는 이벤트도 함께 진행된다.
이밖에 행사기간 동안 전국 주요 점포에서는 10만 원 이상의 상품을 구입하면 1만원을 할인해주는 행사를 진행하고 있다.
현대홈쇼핑은 지난달 31일부터 이 달 1일까지를 '추석선물 기획전'으로 정하고 고객들의 편의를 위해 홈페이지에서 판매하고 있는 인기상품들을 모아 선보이고 있다.</d> 한국은행이 기준금리를 연 1.25%로 동결했다.
한은 금융통화위원회는 9일 정례회의를 열어 만장일치로 현행 금리(연 1.50%)를 유지하기로 결정했다.
기준금리 인상은 올 들어 세 번째다.
지난 7월과 8월 두 차례 금리인상을 단행했지만 한 번도 인상하지 않았다.
올해는 물가상승률이 2"
178,루비한복 여아한복 단이랑,아기한복,36900,https://link.coupang.com/a/MES7Z,thumbnail6.coupangcdn.com/thumbnails/remote/230x230ex/image/vendor_inventory/be13/88fc54eddd974d6f4c1d095b437291737a7096ec8dfbefe0005b907a31b8.jpg,"루비한복 여아한복 단이랑솔직후기
#여아는옷 <unk>kohyura_official</d> 오늘은 내일도 화이팅!!
오늘의 포스팅을 마무리하고 싶어서~^^ 
내일은 또 다른 날이에요...
그래서 이번 주말에도 다시 한번 더 찾아뵙고싶어요
저는 어제부터 계속 이쁜 옷들 챙겨입었답니다ᄒ.ᅲᄏ;)
그런데 저는 이제서야 제가 입고 있는 옷을 보고 깜짝 놀랐어요.
저희 집엔 이렇게 예쁜 것들이 많더라구요.
제가 입었던 옷은 정말 예쁘죠?
그리고 그 안에 담긴 사진들은 너무너무 귀엽네요.ㅠㅠ ;수...?.......^-/// / ** -><• • (사진 옆으로 넘겨보기) -
(사진을 보니까, 진짜 잘 어울린다고 하셨는데.....) 그래서 그런지 제게 제일 먼저 눈에 띄던 게 바로"
179,아가명주 남아용 푸른산호수 한복세트,아기한복,38900,https://link.coupang.com/a/MES8Q,thumbnail6.coupangcdn.com/thumbnails/remote/230x230ex/image/rs_quotation_api/9jw2at78/c587d18baa0e4ca5a8284db8bac0c7c8.jpg,"아가명주 남아용 푸른산호수 한복세트솔직후기
#아기옷 <unk>baby_moonlights</d> 오늘은 제가 좋아하는 과자랑 빵을 먹었어요.
빵이 너무 맛있어서 저는 그냥 먹고 싶었는데...
그냥 먹는게 아니라 진짜로 맛있는거 같아요.
그래서 이번에 먹은건 바로 ``오레오칩스 초코쿠키!
초코는 쿠키와 함께 먹으면 더 좋겠더라고요~^^ 
그리고 오레오는 정말 달달한데...ᄏᄒ.ᅲ!??
근데, 이렇게 초콜릿도 같이 먹어줘야지 하고 생각했는데....ㅠㅠㅜㅜ ;;)
저는 요렇게 먹을 수 있는걸 좋아하는데......ᅮ..... 그래서 다른것도 다 먹기 전에 먼저 먹어야겠다고 생각하고 있었거든요.^-/// 그래도 이건 꼭 드셔보세요
(사실 그닥 좋은 건 아니에요,,).<ᄉᄇᄀᄋᄆ)/ (다음에 또 와봐"
180,멜앤슈 아동용 플러피 벨크로 방한 털부츠,키즈부츠,18000,https://link.coupang.com/a/METa3,thumbnail8.coupangcdn.com/thumbnails/remote/230x230ex/image/vendor_inventory/7611/1afbe318b336510cdb4df4680478a8d1d03e8f19fbcbb3a2f6239b40be3f.jpg,"멜앤슈 아동용 플러피 벨크로 방한 털부츠솔직후기
#아기방석 <unk>baby_moonshop.co.kr</d> 오늘은 제가 좋아하는 빵집인 '카페베네' 에서 커피를 마시며 이야기를 나눴습니다.
저는 카페베네의 대표 메뉴 중 하나인 카페라떼에 대해 이야기했었죠.
그런데 그게 아니었어요.
이건 정말 맛있었던 것 같았거든요.
그래서 저는 이걸로 또 한 번 맛을 보고 싶다고 생각했어요.
그리고 다른 분들은 다들 아시겠지만 제 입맛에는 딱 맞는 그런 맛이였답니다.
제가 선택한 건 바로 에스프레소 머신이었어요!
저도 처음엔 그냥 먹었는데 나중에 보니까 진짜 달달하고 향긋해서 좋더라고요
커피와 함께 먹으면 더 맛있는 거 같아요..
사실 이런 디너메트로 가면 꼭 드셔야 하는 게 있는데.. 사실 아메리카노나 콜라도 있잖습니까?
"
181,어몽어스 아동용 바운스 방한부츠 PO159,키즈부츠,28300,https://link.coupang.com/a/METb2,thumbnail6.coupangcdn.com/thumbnails/remote/230x230ex/image/rs_quotation_api/tfy5a2h6/5a4420d75370480ea586538ea80d1857.jpg,"어몽어스 아동용 바운스 방한부츠 PO159솔직후기
#아기방한의원 <unk>by_monghan.com</d> 오늘은 제가 좋아하는 빵을 소개해드릴게요.
저는 이번에 처음 먹어보는 크림빵이랍니다.
크림치즈케이크가랑 크림이 들어있어서 너무 맛있게 먹었어요.
그리고 치즈가 들어간 케익도 있었구요,
그냥 그냥 평범한 식감이었답니다.
그래서 저는 이렇게 직접 만들어먹고 싶었는데...
제가 만든건데요~!
저희는 요렇게 만들었습니다.
우선 위에 올려진 건 바로바로!?
위에 올라간 거 보니까, 진짜 잘 익었다고 하더라구, 그래서 더 맛있는 것 같아요
다음에 또 드셔보세요.^^ 
맛있는거 먹고싶으신 분들은 꼭 한번 해봐야겠네여...ᄒᄉᄏ;)
오늘의 메뉴를 알려드리려고 하는데요, 제 생각"
182,GAP 스노우 방한 부츠,키즈부츠,44300,https://link.coupang.com/a/METcT,thumbnail9.coupangcdn.com/thumbnails/remote/230x230ex/image/vendor_inventory/1776/7655e20c75cc5940d700bb7fa1015b55e669b4b08b0ed837303c3464ff9a.jpg,"GAP 스노우 방한 부츠솔직후기 등 다양한 이벤트를 진행한다.
또한, 오는 31일까지 ‘2018 S/S 시즌 컬렉션’을 구매하는 고객에게는 추첨을 통해 스타벅스 기프티콘, 롯데월드 자유이용권 등을 증정할 예정이다.
이번 행사는 전국 백화점 및 면세점, 온라인몰에서 동시에 진행된다.
신세계백화점은 이번 행사 기간 동안 신관 지하 1층 식품관에서 ‘신선식품 특별전’과 함께 프리미엄 생필품 할인전을 연다.
‘프리미어’ 브랜드를 비롯해 국내산 냉장 삼겹살과 호주 청정우를 사용한 ‘삼계탕’, 미국 캘리포니아의 유명 맛집인 ‘오렌지주스, 오렌지, 파인애플&오리지널’의 대표 메뉴들을 최대 50% 저렴하게 판매한다.</d> 지난해 12월 말 기준 우리나라 국민 1인당 연간 소비지출은 4억2천만원으로 전년보다 7.2% 증가했다.
이는 같은 해 전체 소비자물가 상승률(2.9%) 보다 높은 수준"
183,슈펜키즈 아동용 윈터 패딩부츠 HPKV7C401S,키즈부츠,29850,https://link.coupang.com/a/METdA,thumbnail10.coupangcdn.com/thumbnails/remote/230x230ex/image/rs_quotation_api/q87klybc/5e42585d113c4f9fac8414dfaa7a6b54.jpg,"슈펜키즈 아동용 윈터 패딩부츠 HPKV7C401S솔직후기
HDR-1500/1650 / 1660g의 가벼운 무게와 편안한 착용감을 자랑하는 제품으로 출시된지 얼마 되지 않아 많은 사랑을 받고 있다.
이번 신제품은 가볍고 따뜻하며 보온성이 뛰어난 소재를 사용하여 활동성을 높인 것이 특징이다.
또한, 방수 기능성 소재인 '에어리즘' 원단을 사용해 땀을 빠르게 흡수하고 쾌적하게 입을 수 있도록 도와준다.
특히, 이 제품은 기존 아웃도어의류보다 가벼워 야외활동 시에도 쾌적한 착화감과 함께 체온 유지에 도움을 준다.
여기에 발열 기능이 있는 쿨맥스 재킷과 방풍 기능을 갖춘 다운재팬 등 다양한 아이템들을 선보이고 있어 더욱 눈길을 끈다.
아웃핏 부츠는 물론 캐주얼룩으로도 활용 가능한 실용적인 상품이다.
신발 밑창에는 통기성과 신축성, 투습력이 우수한 나일론 소재의 스트라이프 패턴 코트를"
184,스티코 키즈 SEB-K10 아동 장화미끄럼방지 레인부츠 여아 남아 유아,키즈부츠,49000,https://link.coupang.com/a/METeA,thumbnail7.coupangcdn.com/thumbnails/remote/230x230ex/image/vendor_inventory/c1df/906a623cb04d4ba692e45877f697f72595ec95e8d5ac27a1500272e0aca8.jpg,"스티코 키즈 SEB-K10 아동 장화미끄럼방지 레인부츠 여아 남아 유아솔직후기
#키즈워크 <unk>kids_book</d> 오늘은 제가 좋아하는 빵집인 '카페베네' 에서 커피를 마시며 이야기를 나눴습니다.
저는 카페베네의 대표 메뉴 중 하나인 카페라떼에 대해 이야기했었죠.
그런데 그게 아니었더라구요.
이건 정말 맛있었던 것 같았어요.
그리고 이번에 나온 신메이드빵도 역시나 맛이 좋았던 듯 했답니다.
그래서 저는 다른 가게에서 사온 수제버거와 함께 먹기로 결정하였지요.
제가 선택한 것은 바로 `커피`였습니다. 고소한 버거를 좋아해서 그런지 매콤한 맛을 싫어하는 사람들도 많았지만 그래도 너무 달달한 맛은 아니었고 그냥 단짠단맛과 부드러운 식감이 더해져 아주 만족스러웠어요!
사실 이런 디저트들은 대부분 다 초콜릿이나 케이크 같은 거"
185,페이퍼플레인키즈 아동 장화 키즈 레인부츠 유아 남아 여아 어린이,키즈부츠,19900,https://link.coupang.com/a/METfn,thumbnail10.coupangcdn.com/thumbnails/remote/230x230ex/image/vendor_inventory/50c0/5b6c2cbd960c9afe1454b3b36467547506cbff63cbb2c19fabdc3d67425e.jpg,"페이퍼플레인키즈 아동 장화 키즈 레인부츠 유아 남아 여아 어린이솔직후기
#유아동 <unk>young_middlee.com</d> 오늘은 제가 좋아하는 빵집인 '카페베네' 에서 커피를 마시며 이야기를 나눴습니다.
저는 카페베네의 대표 메뉴 중 하나인 카페라떼에 대해 이야기했지요.
그런데 그게 사실이었어요.
이건 정말 맛있었죠.
그리고 이번에 나온 신메이드빵도 역시나 맛이 좋았답니다.
그래서 저는 직접 만든 수제버거와 함께 먹기로 했습니다.^^ 
제가 선택한 버거는 바로 `바닐라`입니다.
여기에 치즈를 더해서 달달한 맛을 냈는데요.
치즈가 너무 많이 들어가 있어서 그런지 바닐라에 비해서는 느끼하지 않았어요!
하지만 이렇게 맛있는 건 처음이라 생각했는데...
사실 이런 맛은 좀 아쉬웠지만 그래도 제 입맛에는 딱 맞는 것 같아요.ᄒᄏ;)
저"
186,휠라키즈 솔리드 꾸미 윈터부츠 3XM01829E,키즈부츠,38260,https://link.coupang.com/a/METfY,thumbnail10.coupangcdn.com/thumbnails/remote/230x230ex/image/retail/images/14678209459126-e0ef32bb-8042-4fdc-8cec-cf6751c9c6f4.jpg,"휠라키즈 솔리드 꾸미 윈터부츠 3XM01829E솔직후기
#2019 <unk>korea.kr</d> 오늘은 제가 좋아하는 빵집인 '카페베네' 에서 커피를 마시며 이야기를 나눴습니다.
저는 카페베네의 대표 메뉴 중 하나인 카페라떼에 대해 이야기했었죠.
그런데 그게 아니었더라면 저는 이 가게에서 일하지도 못했을 것 같았어요.
그래서 직접 가서 맛보고 싶었던 것이 바로, 아메리카노였거든요.
이렇게 해서 나온 게 카라멜 마키아또입니다.
카라메라는 이름은 원래 이탈리아어로 ""마피아""라는 뜻이었답니다.
하지만 지금은 그냥 '마피아가 아니다'라는 뜻으로 바뀌었다고 해요.
그리고 이렇게 생긴 마카롱을 먹으면서 느낀 건 역시나 달콤한 맛이 아니라 부드럽고 촉촉한 느낌이라는 것이었지요.
사실 이런 맛은 정말 처음 먹어보는 거라고 생각했는데 사실 너무 신기했어요.
아무래도 초콜릿과 잘 어울리지 않는 향이라 그런지 조금 더 부드러운"
187,BAYB 유아용 패딩 방한 털부츠,키즈부츠,27900,https://link.coupang.com/a/METgN,thumbnail8.coupangcdn.com/thumbnails/remote/230x230ex/image/rs_quotation_api/xcyddvry/b6563c86b36d4891b7ab0a5edfe7c859.jpg,"BAYB 유아용 패딩 방한 털부츠솔직후기’를 모집한다.
이번 이벤트는 오는 31일까지 진행되며 당첨자는 다음달 1일 발표된다.
자세한 내용은 홈페이지에서 확인할 수 있다.
유아용품 전문기업 (주)아이비클럽은 ‘2018 F/W 시즌 신상 아동복 컬렉션’을 출시했다.
‘FREE STONE’ 라인으로 선보인 이번 신제품에는 기존 제품 대비 20% 이상 가벼워진 소재를 사용해 활동성을 높였다.
또한, 신축성이 뛰어난 소재와 기능성 원단을 적용해 보온성과 통기성, 착용감이 우수하다.
특히, 이번에 출시한 제품은 기존의 아이템과 달리 가볍고 편안함을 강조한 것이 특징이다.
신발 밑창에 부착된 특수 코팅을 통해 발바닥의 충격을 흡수하고 발을 감싸는 구조로 제작돼 발의 피로도를 최소화했다.
여기에 신발 바닥면에 부착하는 스티커로 포인트 효과를 더했으며, 다양한 컬러를 활용해 디자인도 차별화했다.</d> 한국거래소는 지난 18일부터 이틀"
188,바브키즈 러블리덕기모세트,키즈부츠,16900,https://link.coupang.com/a/METhD,thumbnail6.coupangcdn.com/thumbnails/remote/230x230ex/image/vendor_inventory/e4bc/eaf1d7b57bc205a0c7dc96017400c7503e8a85bc5a3b91dcccbbb6d72f55.jpg,"바브키즈 러블리덕기모세트솔직후기
#러플 <unk>lovely_official</d> 오늘은 제가 좋아하는 과자랑 빵을 먹었어요.
빵이 너무 맛있어서 저는 그냥 먹고 싶었는데요.
그냥 먹는게 아니라 직접 만들어먹고싶더라구요!
저는 이번에 처음 먹어보는 과일잼과 함께 먹으면 더 맛있는것 같아요
그리고 그 위에 치즈를 올려서 먹을 수 있어요.
치즈는 정말 달달하고 고소해서 먹기 좋았어요..
그래도 이렇게 잘 익지 않아서 그런건가요?
아니면 다른거로 드시거나..?
제가 먹은 건데...ᄏ.ᅲᅮㅠㅠ 
저희는 요렇게 주문했어요.
사진을 찍으면서, 사진찍으려고 했는데....!?ᄒ;)
사진만 찍어봤는데 진짜 엄청 귀여웠네용~^^ ;ᄉ<///^-• • -
오늘의 포스팅은, 바로 ``오레오칩스 초"
189,헤지스키즈 아동용 방한화 HSB64UC07G,키즈부츠,84650,https://link.coupang.com/a/METir,thumbnail6.coupangcdn.com/thumbnails/remote/230x230ex/image/retail/images/2022/11/29/12/8/bb73e284-4bbe-499a-b6ad-75eda95dcc2d.jpg,"헤지스키즈 아동용 방한화 HSB64UC07G솔직후기’를 출시했다.
이 제품은 기존 제품보다 방수 기능이 강화된 것이 특징이다.
방수 기능은 물론 발열 기능까지 갖춰 여름철 야외 활동 시에도 쾌적하게 착용할 수 있다.
또한, ‘HDMI’ 기능을 통해 스마트폰과 태블릿PC, 노트북 등 다양한 기기에 연결해 사용할 수도 있다.</d> 한국과학기술원(KAIST) 생명과학과 김민규 교수팀은 최근 미국 국립과학원회보(PNA Science of Nutrition)에 발표한 논문에서 이 같은 사실을 확인했다고 20일 밝혔다.
연구팀에 따르면 연구진은 쥐의 뇌에서 신경세포로 가는 신호전달 물질인 'L-글루코사민(glucosamine)' 수용체를 발견했다.
이는 L-아세틸콜린산(hydroxylcolinic acid)의 일종인 것으로 알려진 물질이다.
김 교수는 ""뇌는 세포 내 신호를 전달하는 중요한 역할을 하는 단백질로, 이를 이용해"
190,휠라키즈 솔리드 꾸미 윈터부츠 3XM01829E,키즈부츠,53160,https://link.coupang.com/a/METjn,thumbnail7.coupangcdn.com/thumbnails/remote/230x230ex/image/retail/images/631179939089325-f4ad7443-70de-4e3d-8445-0cbb6aca651e.jpg,"휠라키즈 솔리드 꾸미 윈터부츠 3XM01829E솔직후기
#2019 <unk>korea.kr</d> 오늘은 제가 좋아하는 빵집인 '카페베네' 에서 커피를 마시며 이야기를 나눴습니다.
저는 카페베네의 대표 메뉴 중 하나인 카페라떼에 대해 이야기했었죠.
그런데 그게 아니었더라면 저는 이 가게에서 일하지도 못했을 것 같았어요.
그래서 직접 가서 맛보고 싶었던 것이 바로, 아메리카노였거든요.
이렇게 해서 나온 게 카라멜 마키아또입니다.
카라메라는 이름은 원래 이탈리아어로 ""마피아""라는 뜻이었답니다.
하지만 지금은 그냥 '마피아가 아니다'라는 뜻으로 바뀌었다고 해요.
그리고 이렇게 생긴 마카롱을 먹으면서 느낀 건 역시나 달콤한 맛이 아니라 부드럽고 촉촉한 느낌이라는 것이었지요.
사실 이런 맛은 정말 처음 먹어보는 거라고 생각했는데 사실 너무 신기했어요.
아무래도 초콜릿과 잘 어울리지 않는 향이라 그런지 조금 더 부드러운"
191,베네통키즈 아동용 퀼팅 패딩 부츠 QCSHQ6261PK,키즈부츠,39850,https://link.coupang.com/a/METkn,thumbnail9.coupangcdn.com/thumbnails/remote/230x230ex/image/retail/images/2022/11/07/10/7/d161770e-2b03-45af-900c-e5a15110c5f9.jpg,"베네통키즈 아동용 퀼팅 패딩 부츠 QCSHQ6261PK솔직후기
#유아패션그램<unk>naver.com/kids_ofinstagram</d> 오늘은 제가 좋아하는 빵집인 '카페베네' 에서 커피를 마시며 이야기를 나눴습니다.
저는 카페베네의 대표 메뉴 중 하나인 카페라떼에 대해 이야기했었죠.
그런데 그게 아니었더라구요.
이건 정말 맛있었던 것 같았어요.
그리고 이번에 나온 신메이드빵도 역시나 맛이 좋았던 듯 했답니다.
그래서 저는 다른 분들께서도 많이 드셨던, 그리고 또 한 번 더 말씀드리고 싶은 것이 바로 `커피`였거든요..
사실 이런 종류의 음료들은 대부분 다 마셔야 하는 거잖습니까?
하지만 요즘에는 그런 음료를 마시는 사람들이 많아졌으니까요,
저희 집에서도 이렇게 다양한 종류를 가지고 있는 것도 참 신기"
192,오즈키즈 유아동용 코니코니 LED 털부츠,키즈부츠,43900,https://link.coupang.com/a/METlo,thumbnail6.coupangcdn.com/thumbnails/remote/230x230ex/image/retail/images/3115954208963264-af7efcd7-3cd7-44cc-bb87-84112b60ec85.jpg,"오즈키즈 유아동용 코니코니 LED 털부츠솔직후기
#유아용품 <unk>by_mooni</d> 오늘은 제가 좋아하는 빵집인 ``오뎅빵집에서 만든 수제버거!
이제부터 먹어봐야겠어요~!^^ 
제가 먹은 버거는 바로 이게 진짜 맛있었어요.
그리고 저는 치킨을 좋아해서 먹었는데요.
치느님도 먹고싶고.
그런데..ᄏ.ᄒ;)
저는 개인적으로 닭가슴살과 계란찜, 그리고 소고기튀김까지 다 먹을 수 있었거든요.ㅠㅠ ;ᅲ 그래서 더더욱 좋았답니다.
저희는 그냥 튀긴 감자칩으로 주문했구요,
닭 가슴살은 정말 부드럽고 고소하고 담백했어요.
계란은 너무 달달하니까 넘나 맛있는 것 같아요
그래서 이렇게 찍어먹으면 좋을것 같네요?
소스는 역시 매콤하면서 고소한 맛이 나서
맛있게 잘 먹는 편이에요.
다음에"
193,스파이더맨 아동용 피터 LED 부츠,키즈부츠,34900,https://link.coupang.com/a/METmD,thumbnail8.coupangcdn.com/thumbnails/remote/230x230ex/image/retail/images/2020/10/13/17/8/a8f41c89-23d1-42d6-8524-2472f61be3eb.jpg,"스파이더맨 아동용 피터 LED 부츠솔직후기 등 다양한 제품을 선보인다.
또한 이번 전시회는 '2018 서울국제아동미술제' 공식 후원사로 참여한다.
전시회에는 세계 각국의 미술관과 갤러리들이 참여해 어린이들의 창의력과 상상력을 자극하는 작품들을 만날 수 있다.
특히, 올해 처음으로 열리는 국제아트페어에서는 지난해에 이어 두 번째로 개최되는 만큼 관람객들에게 보다 풍성한 볼거리를 제공할 예정이다.
서울시 관계자는 ""올해는 코로나19로 인해 온라인 화상회의와 비대면 방식으로 진행됐다""며 ""이번 전시회 역시 온라인으로만 개최돼 아쉬움이 많았지만, 많은 분들께서 함께 즐기셨으면 좋겠다""고 말했다.</d> 한국관광공사는 오는 10월 1일부터 11월 30일까지 ‘2019년 관광주간’을 맞아 국내 여행업계 종사자 및 관광객을 대상으로 한 설문조사 결과를 발표했다.
설문조사 결과 응답자의 88%가 “국내여행에서 가장 중요한 것은 안전”이라고 답했다.
이어 △안전하고 즐거운 여행을 위한 준비사항(복"
194,겨울왕국 2 아동용 모리 LED 부츠,키즈부츠,36900,https://link.coupang.com/a/METnu,thumbnail7.coupangcdn.com/thumbnails/remote/230x230ex/image/retail/images/2020/10/13/16/5/1a6d79f6-53fe-4812-8abe-382a0dad99b9.jpg,"겨울왕국 2 아동용 모리 LED 부츠솔직후기 등 다양한 상품을 선보인다.
또한 오는 30일까지 '2018 S/S 시즌 컬렉션'을 통해 롯데백화점 상품권 증정 이벤트를 진행한다.
이번 행사에서는 인기 아이템인 모피를 비롯해 가방, 신발, 액세서리 등을 최대 70% 할인 판매하며, 구매 금액대별로 사은품도 제공한다.
특히 이번 행사는 지난해보다 더 많은 고객들이 참여할 수 있도록 기획됐다.
먼저 올해는 코로나19로 인해 온라인 쇼핑의 비중이 높아짐에 따라 백화점의 경우 전년 대비 20% 이상 매출 신장률을 기록했다.
이에 맞춰 신세계몰은 이달 말까지 '신상품 초특가전'과 함께 패션 브랜드를 중심으로 한 프로모션을 준비했다.
대표적으로 ▲신발·액세·핸드백 균일가에 나선다.
우선 남성 정장 및 캐주얼 의류를 특가로 판매하는 '이니스프리' 행사를 연다.</d> 현대자동차가 미국 자동차 전문지 오토블로그(Autoblog"
195,스토 아동용 리틀 윈터 퍼 부츠,키즈부츠,24720,https://link.coupang.com/a/METow,thumbnail10.coupangcdn.com/thumbnails/remote/230x230ex/image/retail/images/2017/11/08/10/3/ab248459-19a7-4f91-83ba-f29ff55e24d9.jpg,"스토 아동용 리틀 윈터 퍼 부츠솔직후기’를 진행한다.
이번 행사는 오는 30일까지 진행된다.
참여 방법은 리빙소품샵에서 제품을 구매한 후 이벤트 페이지에 댓글을 남기면 된다.
당첨자는 다음달 1일 발표된다.
리얼윈터는 지난해 12월 출시 이후 현재까지 약 4000여개 이상의 판매고를 올리고 있다.
올해는 코로나19로 인해 온라인 쇼핑몰과 오프라인 매장을 중심으로 수요가 급증하고 있는 상황이다.
특히, 올 상반기 매출은 전년 동기 대비 2배 이상 증가했다.
또한, 이번에 진행되는 ‘2020년 봄·여름 시즌’ 이벤트는 전국 주요 백화점 및 대형마트, 홈쇼핑 등 총 100여개의 공식 몰을 통해 참여할 수 있다.</d> 한국거래소는 코스닥시장 상장법인 중 최근 3년간(2009~2011년) 매출액 증가율이 가장 높은 법인을 대상으로 '2012년도 결산실적'을 분석한 결과 이같이 나타났다고 27일 밝혔다.
매출액증가율은 유가증권시장의 경우 ▲2009년 -0.3%(+"
196,아동용 털부츠 KD3195,키즈부츠,16000,https://link.coupang.com/a/METpi,thumbnail6.coupangcdn.com/thumbnails/remote/230x230ex/image/retail/images/2020/10/26/11/1/f5231269-e059-4109-a7b2-93c0563361a1.jpg,"아동용 털부츠 KD3195솔직후기’를 모집한다.
모집분야는 △아동복 및 잡화 부문이다.
응시자격은 만 18세 이상 대한민국 국민이면 누구나 지원할 수 있다.
자세한 내용은 홈페이지(www.mofekorea.kr)에서 확인할수 있다.</d> 지난해 12월 31일부터 올 1월 1일까지 진행된 이번 공모전은 ‘2018 평창동계올림픽의 성공적 개최를 위한 올림픽 마케팅 전략’을 주제로 진행됐다.
이번 공모는 동계스포츠를 통해 대한민국의 위상을 높이고 국가 브랜드 가치를 제고하기 위해 마련됐으며, 총 330여개 팀이 응모, 치열한 경쟁을 펼쳤다.
특히, 최종 수상팀에는 상금 1000만원이 수여되는 등 역대 최대 규모의 시상식이 열렸다.
수상작은 오는 2월 8일 발표될 예정이다.
한편, 한국관광공사는 2018평창겨울패럴림픽대회 기간 동안 다양한 이벤트를 개최하며 국내 관광업계와의 소통을 강화한다는 계획이다. 고객과 함께하는 열린 여행으로 새로운 도약을 준비하고 있는 한류스타"
