,names,keyword,prices,urls,images,ments
359,베베드피노 키즈 바바퍼부츠_BP24AS388,베베드피노,69000,https://link.coupang.com/a/MEVRg,thumbnail10.coupangcdn.com/thumbnails/remote/230x230ex/image/vendor_inventory/2640/7a3f6466748aeca7c8426c9bd6213fb9d065b29d17731af17207635defa9.jpg,"베베드피노 키즈 바바퍼부츠_BP24AS388솔직후기
#키자니아 <unk>kidzania</d> 오늘은 내일도 화이팅!!
오늘의 포스팅을 마무리하는 날입니다.
이번 주말에도 역시나 즐거운 하루 보내시길 바랍니다.
다음주 월요일에는 다시 한번 더 좋은 소식들 많이 들려올 것 같습니다.
저희 가족 모두 행복한 시간 되시기를 바라며..
내일은 또 다른 날이 될 수 있을 거라 생각합니다.
아침부터 너무 행복하고 기분 좋으셨어요.
그리고 이번 주는 정말 오랜만에 가족과 함께 하는 시간이 되었네요.
그동안 힘들었던 일들이 조금이나마 풀릴 것으로 기대됩니다.
또한 저는 항상 건강하시고 맛있는 음식을 먹으며 즐겁게 보냈던 기억에 감사드리며, 앞으로 더욱더 열심히 살아가겠습니다.^^ 
지금까지 잘 지내왔는데.. 이번에 꼭 만나서 고맙다는 말씀 드리고 싶어서요~ᄒ;"
360,더예한복 남아용 가든서진 한복세트 506,남아한복,29900,https://link.coupang.com/a/MEVSx,thumbnail6.coupangcdn.com/thumbnails/remote/230x230ex/image/retail/images/1942406714665555-ad8986eb-fe3d-4d67-83c1-4402f0d5d97f.jpg,"더예한복 남아용 가든서진 한복세트 506솔직후기
#가드닝 <unk>doggardening_official</d> 오늘은 제가 좋아하는 과자랑 빵을 먹었어요.
빵이 너무 맛있어서 저는 그냥 먹고 싶었는데...
그냥 먹는게 아니라 진짜로 맛있는거 같아요.
그래도 이번에 먹은건 정말 잘먹고 왔네요~!
오늘의 포스팅으로 소개해드리겠습니다!^^ 
저는 어제 저녁부터 아침까지 열심히 먹어왔는데.ᄏᄒ;)
아침 일찍 일어나니 배가 고파져서인지 점심때쯤에는 좀 늦게 일어났습니다.
그리고 또 한가지, 바로 ``오빠와 함께하는 오빤 우리집 식구들인데...??
우리집에 온지 얼마 안됐지만 오빠를 위해 준비한 음식들이 너무나 많았어요.ㅠㅠ ;ᅲᅮㅜㅜ.^/♥♡ -
저희는 아침에 일어나자마자 밥과 반찬을 챙겨주"
361,아가명주 남아용 금박미르 한복,남아한복,31290,https://link.coupang.com/a/MEVTj,thumbnail7.coupangcdn.com/thumbnails/remote/230x230ex/image/retail/images/2019/08/08/20/7/29b926fe-6be5-45dd-a68d-9997ec702c8a.jpg,"아가명주 남아용 금박미르 한복솔직후기
#금박이미지 <unk>dongju_mini</d> 오늘은 내일도 화이팅!!
오늘의 포스팅을 마무리하고 싶어서요~^^ 
이번 주말에도 또 다시 찾아뵐게욤ᄒ..
저희집엔 항상 맛있는 음식들이 가득하답니다ᄏ;)
아침부터 저녁까지 맛있게 먹었어요
그리고 저는 요렇게 주문한 메뉴를 먹고싶었는데..ㅠㅠ ;수ᅲ 너무너무 좋았습니다
메인 디쉬에 있는 소고기 스테이크가 나왔는데요,
소고기는 정말 부드럽고 고소한 맛이 나더라구요.
스테이크로 나온 고기들은 진짜 고소해서 더 좋아했답니다.
그런데 이번에 제가 선택한 것은 바로 ``오징어의 살코기살구이였어요.
저는 오뎅탕과 함께 먹으면 더욱 좋을 것 같아서
그래서 이렇게 샐러드랑 같이 먹어봤습니다.
"
362,TCR 남아정장세트 아동정장 유아정장 돌잔치정장,남아한복,52000,https://link.coupang.com/a/MEVTZ,thumbnail7.coupangcdn.com/thumbnails/remote/230x230ex/image/vendor_inventory/aae9/d3107b144a94ac8cd9cb0839054f5e512a0766d7f245e9892f453eccf49d.jpg,"TCR 남아정장세트 아동정장 유아정장 돌잔치정장솔직후기 등 다양한 이벤트를 진행한다.
이번 행사는 오는 30일까지 진행된다.
행사기간 동안 매일 선착순 100명에게 '남아 정장을 입은 아빠'에게 선물을 증정한다.</d> 지난해 12월 31일부터 올 1월 1일 사이에 발생한 교통사고는 모두 1천2백여 건으로 이 가운데 절반 이상이 음주운전으로 인한 것으로 나타났습니다.
경찰청은 오늘(30일) 이같은 내용을 담은 도로교통법 개정안을 입법예고했다며 이같이 밝혔습니다..
개정안은 또 운전자가 과속이나 신호위반 등을 하지 않고 차량을 운행할 경우 과태료를 부과하도록 했습니다. 경찰은 이와 함께 자동차보험 가입자의 사고기록과 보험가입자 정보를 연계한 새로운 정보시스템을 구축하기로 했다고 설명했다..</d> 서울중앙지검 특수1부(부장검사 이원석)는 이날 오전 10시께 김 전 실장과 조윤선 문화체육관광부 장관을 피의자로 불러"
363,더예한복 남아용 230 으뜸유현 한복세트,남아한복,38900,https://link.coupang.com/a/MEVUR,thumbnail10.coupangcdn.com/thumbnails/remote/230x230ex/image/rs_quotation_api/njxwscy6/a26d18747593431097cdbdc2d7c3654a.jpg,"더예한복 남아용 230 으뜸유현 한복세트솔직후기
#남아 <unk>korea_maeil.com</d> 오늘은 제가 좋아하는 과자랑 빵을 먹었어요.
빵이 너무 맛있어서 저는 그냥 먹고 싶었는데요.
그냥 먹는게 아니라 직접 만들어먹고싶더라구요!
저는 이번에 처음 먹어보는 과일잼과 함께 먹으면 더욱 맛있는 것 같아요
그리고 그 위에 딸기쨈도 같이 들어있어서
딸기맛에 빠져서 행복했어요..
그래야 제 입맛이 살아나니까~^^ 
오늘의 포스팅으로 <과일&초콜릿> 을 소개해드릴께요,
<사과, 딸기, 초콜릿>
제가 선택한 사과는 사과향이 은은하게 나고, 달콤한 맛이 나는 것이 특징이에요.
또한, 초코칩에는 바나나향, 블루베리 향 그리고 코코넛 향이 들어가 있어 아이들도 좋아할만한데..ᄒᄉᄏ 그래서인지 아이들이 먹기에도 좋고 먹기도 편해서 좋았"
364,아바마 아기 유아 신생아 턱받이 헤어밴드 동글 턱받이 헤어밴드 2세트 B세트,남아한복,25600,https://link.coupang.com/a/MEVVu,thumbnail6.coupangcdn.com/thumbnails/remote/230x230ex/image/vendor_inventory/89b9/7acc4afd56dffb795dea1973bdf1753d60eafcb508bc2be26da75108fbca.jpg,"아바마 아기 유아 신생아 턱받이 헤어밴드 동글 턱받이 헤어밴드 2세트 B세트솔직후기
#아기 <unk>baby_kim</d> 오늘은 제가 좋아하는 빵집인 '카페베네' 에서 커피를 마시며 이야기를 나눴습니다.
저는 카페베네의 대표 메뉴 중 하나인 카페라떼에 대해 이야기했지요.
그런데 그게 사실인지 아닌지 궁금해서 직접 찾아가봤어요.
이번에는 저의 친구들이랑 함께 갔는데요.
저희 가게는 정말 맛있었답니다.
그리고 이번에 방문한 곳은 바로 `커피베이` 입니다.
제가 가장 좋아했던 곳인데요,
바로 이곳입니다.
여기서부터가 진짜 맛있는 것 같았거든요!
그래서 이렇게 찾아왔고요
사실 이곳은 제 취향이 아니였나봐요?
하지만 여기까지 왔으니까 더더욱 맛이 좋았던 거 같아요..
다음날도 또 방문할 예정이라고 하니깐, 꼭 한번 들러보시길 바래봅니다."
365,[메르시보꾸] SS22W01 뮤즈기모상하,남아한복,20900,https://link.coupang.com/a/MEVWd,thumbnail10.coupangcdn.com/thumbnails/remote/230x230ex/image/vendor_inventory/2409/b8da1c41f4fa8c33d488ca61748ec9c8df20d52f2c9db710bea5957c2e9b.jpg,"[메르시보꾸] SS22W01 뮤즈기모상하솔직후기
#music <unk>beer_korea</d> <17.06.22.Tue> (일)
오늘은 제가 좋아하는 영화 ``아바타: 더 킹 오브 파이터즈의 등장인물들 중 한 명인 아오이 켄지.
<18.08.13.Party>
영화에서 가장 많이 나오는 캐릭터. 그 중에서도 특히나 이 영화는 주인공을 맡은 배우가 바로 나미카제 타쿠야다.
그런데도 불구하고 <아사히신문>에 따르면 그의 이름은 ""타카하시 미츠루""로 되어 있다.
그리고 그가 속한 팀의 멤버는 모두 나카무라 유키코, 그리고 마에다 토시오이다.
(웃음) 그래서인지 그는 항상 자신의 이름을 외친다.
그래서 나는 그를 좋아하지 않는다.
하지만 내가 그에게 관심을 갖는 이유는 아마도 자신이 속해 있는 팀이 아닌 다른 팀을 위해서이기 때문일 것이다.
나는 그와 함께 영화를 찍고 싶다는"
366,더예한복 남아용 233 하유별이 한복세트,남아한복,38900,https://link.coupang.com/a/MEVW3,thumbnail7.coupangcdn.com/thumbnails/remote/230x230ex/image/retail/images/13926441210718535-e087ef4d-bc38-4f05-9c5b-fd29b4c972fa.png,"더예한복 남아용 233 하유별이 한복세트솔직후기
#하희자 <unk>hani_official</d> 오늘은 제가 좋아하는 과일을 먹으러 갔는데요.
저는 과일도 먹고 싶고.
과일 종류도 많고.ᄏᄒ 
오늘의 포스팅을 마무리하고 왔어요.
요즘 날씨가 너무 추워져서..ᅲᅮㅠㅠ.^;)
저희는 어제 저녁부터 아침까지 열심히 일했어요.^^ ;ᄉ*!
아침 일찍 일어나서 점심먹기전에, 저는 아침에 일어나자마자 바로바로 일어났답니다.
그래야 배가 고프지 않나요?
그냥 집에서 먹는게 아니라 밖에서 먹을 수 있는거라서
집에서 직접 만들어먹는걸로~! 하고 나왔답니다 ~??
제가 만든건데... 이번에 처음 먹어보는것 같아요
그리고 요렇게 된것도 있더라고요,
여기에다가 치즈랑 딸기쨈과 함께 먹으면 더욱 맛있었구요,, 그리고 이렇게 나온 것도 있어"
367,아가명주 남아용 라인플라워 한복세트,남아한복,31900,https://link.coupang.com/a/MEVXH,thumbnail9.coupangcdn.com/thumbnails/remote/230x230ex/image/rs_quotation_api/7ljoccds/87c9f0b734ae496893137c311e6c621d.jpg,"아가명주 남아용 라인플라워 한복세트솔직후기
#남아 <unk>lovelyou_official</d> 오늘은 제가 좋아하는 과자랑 빵을 먹었어요.
빵이 너무 맛있어서 저는 그냥 먹고 싶었는데...
그냥 먹는게 아니라 진짜로 맛있는거 같아요.
그래서 이번에 또 먹어봤는데 역시나 달달한 맛이였어요!
그리고 그 위에 크림치즈도 같이 올려져 있어서 정말 좋았답니다.
크림 치즈는 바삭바득 씹히는 식감이 아주 좋아서
먹기에도 편하고 먹기 좋게 잘 구워진것 같더라구요
저는 개인적으로 크림을 많이 안좋아서 그런지 다른 메뉴를 먹을때마다 꼭 드시곤 했는데 이번엔 좀 더 다양하게 만들어보려고 했거든요.ᄒᄉᄏ;)
제가 먹은건 바로 딸기잼인데요,
딸기는 원래 딸기가 아니에요.
하지만 요즘에는 다들 아시겠지만... 그래서 이렇게 직접 만들어서 먹으면 더욱 좋을 것"
368,남아용 할로윈 코스튬 망토 뱀파이어,남아한복,21550,https://link.coupang.com/a/mEezS,thumbnail8.coupangcdn.com/thumbnails/remote/230x230ex/image/retail/images/2020/09/14/19/7/8788e9b8-c0f8-41ce-b6f5-94e1bce78ecb.jpg,"남아용 할로윈 코스튬 망토 뱀파이어솔직후기
#망토와뱀파이어의해 <unk>worldcup_official</d> 2018.06.23.일 ``저녁에~^^ 
오늘은 점심시간이라서 일찍 일어나야겠어요!
아침부터 저녁까지 먹으니까, 오늘도 잘 먹고 오기 시작했네요.
이번엔 좀 더 맛있는거 먹을 수 있을 것 같아서
점심에 먹기 좋은 메뉴를 골라봤어요.
메인 요리는 닭가슴살 스테이크.
닭 가슴살은 소고기랑 같이 먹으면 맛있고, 샐러드는 따로 주문하면 되니까 좋더라구요.ᄒᄏ;)
샐러드에는 치즈소스가 들어가 있어서 넘나 좋아하거든요
치즈가 들어간게 아니라 그냥 고기만 먹는 느낌이에요.
그리고 베이컨과 양파, 그리고 토마토와 파프리카가 들어있어서, 정말 고소하고 담백했어요.
양파와 마늘을 넣어주시면 더욱 맛이 깊어져"
369,아가명주 남아용 찬누리 한복세트,남아한복,29300,https://link.coupang.com/a/MEVZz,thumbnail6.coupangcdn.com/thumbnails/remote/230x230ex/image/rs_quotation_api/4tydaehg/83994fd0d78943c78bf94ca954dc5b4a.jpg,"아가명주 남아용 찬누리 한복세트솔직후기
#남아 <unk>lovely_official</d> 오늘은 제가 좋아하는 과자랑 빵을 먹었어요.
빵이 너무 맛있어서 저는 그냥 먹고 싶었는데요.
그냥 먹는게 아니라 직접 만들어먹고싶더라구요!
저는 이번에 처음 먹어보는 과일이라서 더 좋아했어요
그래도 이렇게 맛있는건 정말 신기하네요..
그리고 또 다른 포스팅으로 <<`오! 와~ 오와...ᄏ> 하고 왔는데요,
제가 제일 먼저 먹은 건 바로 `바나나칩스틱>
과일을 갈아서 만든 음료인데요,, 진짜 달달하고 고소해서 좋았답니다.
저희집 바나나는 바나나맛이라고 하길래..ᄒᄉᄋ; 라고 했더니 그걸로 결정했어요.
사실 이건 좀 생소한데. 그래서 그런지 잘 모르겠지만 그래도 맛은 확실히 좋은 것 같아서
생각보다 훨씬 부드럽고 촉촉한 맛이였습니다.
"
370,아가명주 남아용 꿀벌색동 한복세트,남아한복,39900,https://link.coupang.com/a/MEV0K,thumbnail10.coupangcdn.com/thumbnails/remote/230x230ex/image/rs_quotation_api/bywdv8pe/f1356461be214a2987a8bd0d5a4b9d17.jpg,"아가명주 남아용 꿀벌색동 한복세트솔직후기
#꿀벌이죽 <unk>blog.naver2.com/koreanfood</d> 오늘은 제가 좋아하는 과자랑 빵을 먹으러 갔는데요.
이번엔 저희집 과일빵과 함께한 딸기잼이었어요.
딸기쨈에 딸기가 들어가있어서 좋았어요!
저는 이번에 처음 먹어보는 크림치즈크림칩이라서 맛있게 먹을 수 있었답니다.
그리고 치즈가 들어간 크림이 너무 달아서 더더욱 좋아요
그런데 이렇게 맛있는 건 또 뭐지?
아무래도 초콜릿맛의 맛이 강해서 그런 것 같아요..
그래도 맛은 좋은 편인데..ㅠㅠ 
저희는 그냥 초코쿠키를 먹고싶었는데...ᄏᄒ;!? 하고 생각했는데..........ᅲᅮㅜㅜ ;)
초콜릿맛이 정말 진하고 고소하니까, 진짜 잘 어울렸네여~^^.^_+♥♡ -
"
371,더예한복 남아용 어진별이 한복세트,남아한복,38900,https://link.coupang.com/a/MEV1H,thumbnail9.coupangcdn.com/thumbnails/remote/230x230ex/image/rs_quotation_api/g73wfeaa/7e17126c097a40fd91dc6b0b2d075a71.jpg,"더예한복 남아용 어진별이 한복세트솔직후기
#진짜가보고싶은옷 <unk>jinyoung_official</d> 오늘도 어김없이 출근해서 점심먹고 왔는데...
오늘 아침부터 너무 피곤하고.ㅠㅠ 
아침 일찍 일어나서 저녁을 먹으러 갔더니...ᄏ; 어제 저녁에 먹은게 생각나서
그냥 밥만 먹고 나왔어요~!
그래야지 배가 고파져서 그런건데....ᄒ슈!??
밥 한공기 다 먹어치우고 나온거라 넘 맛있었어요.
그리고 또 하나 빼놓을 수 없는 게 바로 치킨인데요.
바로 닭가슴살이에요.
닭 가슴살은 정말 부드럽고 고소하니까, 그리고 담백하면서 매콤한 맛이 일품이라서, 저는 개인적으로 좋아하는 메뉴 중 하나인 것 같아요
저는 이번에 처음 먹는 소고기예요.
소갈비랑 같이 먹으면 좋겠더라고요.^^ ;)
저희는 그냥 고기집이라고 해서"
372,더예한복 남아용 241 라온그린 한복세트,남아한복,39900,https://link.coupang.com/a/MEV2T,thumbnail10.coupangcdn.com/thumbnails/remote/230x230ex/image/rs_quotation_api/z2uih5ry/0d2170cad9954c7389c442274daadeb7.jpg,"더예한복 남아용 241 라온그린 한복세트솔직후기
#라온의이불 <unk>lotte_official</d> 오늘은 제가 좋아하는 과자랑 빵을 먹었어요.
빵도 맛있고 양도 푸짐해서 좋았어요~!
오늘의 포스팅으로 << ``아침식사>>를 소개해드릴게요.
저는 아침에 일어나서 점심먹고 바로 아침부터 저녁까지 먹을 수 있는 곳이에요.
저희는 저녁에 일찍 퇴근하고 집에 와서 커피를 마시며 시간을 보냈는데요,
저녁에 먹은건데 너무너무 행복했답니다.
그래서인지, 저는 이번에 또 먹고 싶다고 생각했어요.
그리고 아침을 먹기 전에, 친구들이 많이 모여있는 카페에서 식사를 했습니다.
카페가 아닌 곳에서 먹는다는 게 참 신기하더라고요..
친구들과 함께하는 시간이라 그런지 분위기가 정말 좋아보였답니다^^ 
커피 한잔 마시고 나서 이렇게 맛있는 음식을 먹어봤는데,"
373,더예한복 남아용 230 으뜸유현 한복세트,남아한복,38900,https://link.coupang.com/a/MEV3D,thumbnail10.coupangcdn.com/thumbnails/remote/230x230ex/image/rs_quotation_api/njxwscy6/a26d18747593431097cdbdc2d7c3654a.jpg,"더예한복 남아용 230 으뜸유현 한복세트솔직후기
#남아 <unk>korea_maeil.com</d> 오늘은 제가 좋아하는 과자랑 빵을 먹었어요.
빵이 너무 맛있어서 저는 그냥 먹고 싶었는데요.
그냥 먹는게 아니라 직접 만들어먹고싶더라구요!
저는 이번에 처음 먹어보는 과일잼과 함께 먹으면 더욱 맛있는 것 같아요
그리고 그 위에 딸기쨈도 같이 들어있어서
딸기맛에 빠져서 행복했어요..
그래야 제 입맛이 살아나니까~^^ 
오늘의 포스팅으로 <과일&초콜릿> 을 소개해드릴께요,
<사과, 딸기, 초콜릿>
제가 선택한 사과는 사과향이 은은하게 나고, 달콤한 맛이 나는 것이 특징이에요.
또한, 초코칩에는 바나나향, 블루베리 향 그리고 코코넛 향이 들어가 있어 아이들도 좋아할만한데..ᄒᄉᄏ 그래서인지 아이들이 먹기에도 좋고 먹기도 편해서 좋았"
374,하랑한복 여아용 미리랑 한복세트 + 복주머니 랜덤발송,남아한복,37900,https://link.coupang.com/a/MEV4z,thumbnail8.coupangcdn.com/thumbnails/remote/230x230ex/image/retail/images/622203861897113-6da88154-4b6d-4e5c-b50f-7d8c9d954818.jpg,"하랑한복 여아용 미리랑 한복세트 + 복주머니 랜덤발송솔직후기
#육아는장비빨 <unk>daum_official</d> 오늘은 내일도 화이팅!!
오늘의 포스팅을 소개해드릴게요~^^ 
이번주 금요일부터 토욜까지 매일매일 아침마다 출근하는 우리 아들, 엄마, 아빠가 함께 하는 시간이에요.
저희 아들은 엄마보다 더 바쁘고 힘들었어요.
그래서 저는 항상 저녁 늦게 퇴근하고 집에 와서 쉬곤 했답니다.
그런데 이번 주에는 제가 일찍 일어나면 정말 피곤해서 잠들기 전에 깨워서 자야겠더라고요.
엄마께서 너무 힘들어하셔서, 아침에 일어나자마자 바로 일어났더니 몸이 안 좋아져서 잠을 못자고 있었거든요..
그리고 그 다음날에도 또 새벽에 깨어났는데..ㅠㅠ.ᅲ.ᅮᄏ; ;)
저는 어제 저녁에 일어난 덕분에 하루종일을 잘 보내셨다고 해요.
제가 좋아하는 음식"
375,더예한복 남아용 232 은월랑 한복세트,남아한복,34900,https://link.coupang.com/a/MEV5y,thumbnail7.coupangcdn.com/thumbnails/remote/230x230ex/image/rs_quotation_api/qtugu6hn/22291f9a76e547129a59fe5914b1d141.jpg,"더예한복 남아용 232 은월랑 한복세트솔직후기
#남아 <unk>daniel_official</d> 오늘은 제가 좋아하는 과자중 하나인 ``오레오칩스틱(?)>을 소개해드릴게요.
이건 오레오는 아니지만 저는 이걸 좋아하는데요~!
저는 개인적으로 젤리같은거 싫어해서 그냥 먹었는데요
제가 제일 싫어하는 건 바로 초콜릿인데요,
그냥 먹으면 맛있어서 좋더라구요..
그래서 요렇게 해서 먹어봤는데 너무 달달하고 고소하면서 맛이 좋은 것 같아서
저도 모르게 입안에서 사르르 녹는 느낌이었어요,,ᄒᄏ;)
그리고 그 위에 아몬드가 들어있어서, 정말 꿀맛이에욤!?
진짜 진짜로 맛있는 거 같았어요.
근데 이건 또 다른 맛을 느낄 수 있는 그런 느낌이였거든요?
사실 이런 걸 먹을 때면 꼭 먹어야 하는 게 아니잖나 싶기도 하고..ㅠㅠ 
하지만 이렇게 먹는 것도 참"
376,더예한복 남아용 225 하율금빛 한복세트,남아한복,33900,https://link.coupang.com/a/MEV6v,thumbnail9.coupangcdn.com/thumbnails/remote/230x230ex/image/rs_quotation_api/jycptorf/78041f1aa12f420c9cf6a0c175e02bb8.jpg,"더예한복 남아용 225 하율금빛 한복세트솔직후기
#이태원 <unk>daniel_official</d> 오늘은 제가 좋아하는 빵집인 ``아빠가 만든 수제빵을 먹어봤어요
그런데 이게 진짜 맛있더라구요!
제가 직접 만들어본 건 아니지만...
그래서 저는 아까 주문했던 치즈케이크를 먹었답니다
치즈가 너무 많아서 그런지 정말 잘 익고 있었습니다
그리고 그 위에 크림과 크림이 올라가 있어서 완전 꿀맛이었습니다.
크림도 엄청 많이 들어있고.ᄏᄒ 
저는 개인적으로 젤로우라고 생각했는데...ㅠㅠ 그래서 그냥 다 먹고 싶었는데....ᅲᅮ 그래도 이렇게 맛있는 걸 먹을 수 있는 곳이 또 있을까???
저희는 여기까지 왔는데요.
여기서는 꼭 먹어야겠죠!^^ ;;)
제주도 여행가서 제주에 온 친구들이랑 함께 갔어요.
제주도에 도착해서 바로바로 제주를"
377,더예한복 남아용 녹원잎새 한복 세트 226,남아한복,33900,https://link.coupang.com/a/MEV69,thumbnail8.coupangcdn.com/thumbnails/remote/230x230ex/image/retail/images/668332685978933-5fc71b73-43cf-46e3-a691-79d9b342486f.jpg,"더예한복 남아용 녹원잎새 한복 세트 226솔직후기
#녹화 <unk>dongwon_official</d> 오늘은 제가 좋아하는 과자랑 빵을 먹었어요.
빵이 너무 맛있어서 저는 그냥 먹고 싶었는데...
그냥 먹는게 아니라 진짜로 맛있는거 같아요.
그래서 이번에 또 먹어봤는데 역시나 달달하고 고소해서 좋았어요!
그리고 그 위에 치즈도 같이 올려져 있어서 정말 좋아했어요.
치즈가 들어간건 처음인데...ᄏᄒ.ᅲ;!??
저는 이렇게 먹으면 안되겠다 싶어서
먹기 시작했는데 생각보다 양이 많아서 못 먹을뻔 했거든요
근데 이건 좀 아쉬웠지만 그래도 잘 먹은 것 같더라구요.^^ 
아무튼, 이번엔 꼭 먹어야지~♡♥ -
오늘의 포스팅은, 바로 ``오레오칩스 초코파이情(초콜릿)><>
제가 직접 만든 오레"
378,소담예인 예은솔 남아한복 SD10A04,남아한복,47900,https://link.coupang.com/a/MEV76,thumbnail7.coupangcdn.com/thumbnails/remote/230x230ex/image/vendor_inventory/0a90/cef2ea0a14d3d223448017eb25725fcd22799e5dea45b8f98ddce764a48a.jpg,"소담예인 예은솔 남아한복 SD10A04솔직후기
이제부터 시작!!
#아기옷 <unk>sd11_official</d> 오늘도 어김없이, 그리고 내일 또 다시 한 번 더 찾아뵙겠습니다.
오늘의 마지막 날입니다.
내일은 정말 오랜만에 가족들과 함께하는 시간이 되셨으면 좋겠다는 생각이 들었어요.
그런데 저는 이번에 꼭 한번 가보고 싶었던 곳이 바로 부산 해운대해수욕장이었답니다.
해운대에서 가장 가까운 곳에 위치한 해수욕장이랍니다.
부산광역시 수영구 광안동에 위치하고 있는 이곳은 부산의 대표적인 해변으로 손꼽히는 곳이에요.
광안에 위치해 있어 바다 조망권이 매우 좋아요.
특히나 바다를 바라보며 산책할 수 있어서 더욱더 좋은 장소라고 할 수가 있어요.
그리고 무엇보다 이곳에는 다양한 종류의 조개들이 전시되어 있는데요,
조개들은 모두 바다에서 건져 올린 것들이라서 그런지 그 맛이 아주 일품이라고 하네요~^^ 
조개는 물론이고, 각종 해산물과 해"
379,더예한복 남아용 241 라온그린 한복세트,남아한복,39900,https://link.coupang.com/a/MEV9o,thumbnail10.coupangcdn.com/thumbnails/remote/230x230ex/image/rs_quotation_api/z2uih5ry/0d2170cad9954c7389c442274daadeb7.jpg,"더예한복 남아용 241 라온그린 한복세트솔직후기
#라온의이불 <unk>lotte_official</d> 오늘은 제가 좋아하는 과자랑 빵을 먹었어요.
빵도 맛있고 양도 푸짐해서 좋았어요~!
오늘의 포스팅으로 << ``아침식사>>를 소개해드릴게요.
저는 아침에 일어나서 점심먹고 바로 아침부터 저녁까지 먹을 수 있는 곳이에요.
저희는 저녁에 일찍 퇴근하고 집에 와서 커피를 마시며 시간을 보냈는데요,
저녁에 먹은건데 너무너무 행복했답니다.
그래서인지, 저는 이번에 또 먹고 싶다고 생각했어요.
그리고 아침을 먹기 전에, 친구들이 많이 모여있는 카페에서 식사를 했습니다.
카페가 아닌 곳에서 먹는다는 게 참 신기하더라고요..
친구들과 함께하는 시간이라 그런지 분위기가 정말 좋아보였답니다^^ 
커피 한잔 마시고 나서 이렇게 맛있는 음식을 먹어봤는데,"
