,names,keyword,prices,urls,images,ments
540,엘듀아 튼튼 스릴만점 눈썰매 2인용 빨강,눈썰매,19800,https://link.coupang.com/a/MEYHV,thumbnail6.coupangcdn.com/thumbnails/remote/230x230ex/image/vendor_inventory/7601/d260ad3ce77d0b46a2ab3db68ee45c553baa9abf9bcaf02171298821472e.jpg,"엘듀아 튼튼 스릴만점 눈썰매 2인용 빨강솔직후기
#눈 <unk>kids_official</d> 오늘은 제가 좋아하는 빵집인 ``오렌지베리빵이랑 치즈케이크를 먹었어요
치즈가 너무 맛있어서 그냥 먹어봤는데 진짜 달달하고 고소해서 좋았어요.
그리고 오렌지가 정말 잘 어울려서 더더욱 좋아요!
저는 이번에 먹은 오렌지베리를 먹고싶었는데...
그냥 먹는게 아니라서 조금 아쉬웠지만 그래도 먹을 수 있어서 다행이었네요.
그래도 이렇게 맛있는거 먹으면 행복해요.^^ 
오늘의 포스팅을 마무리할께요,,ᄒ.^~!ᄏ;)
제가 선택한건 바로 딸기잼인데요,
딸기쨈에 딸기가 들어가서 더욱 맛이 좋은것 같아서
저희는 직접 만들어먹기로 했답니다 ~♡♥ -
크림색깔로 예쁜데다가 크림색이 예뻐서, 저는 요렇게 찍어"
541,스위스핏 2인용 눈썰매 레드,눈썰매,17800,https://link.coupang.com/a/MEYIF,thumbnail9.coupangcdn.com/thumbnails/remote/230x230ex/image/rs_quotation_api/fmlt3u9f/7501af32f62a4cbb96d73e906d2bdb23.jpg,"스위스핏 2인용 눈썰매 레드솔직후기
#레드슬림 <unk>reedslim_official</d> <17.06.13.Sat> 아침 : 닭가슴살 + 치킨+닭다리튀김, 계란후라이로 구성된 ``치즈볼링세트>
오늘은 토마토소스를 곁들인 샐러드~!
토마토소스랑 함께 먹으면 더 맛있을 것 같아요!^^ 
이렇게 소스도 같이 먹으니까 넘나 좋더라구요
저는 오늘 점심때가 제일 아쉬웠는데...
점심에 먹기 좋은 메뉴를 골라서 먹어봤어요.ᄒᄉᄏ;)
샐러드는 정말 잘 익었어요.
그리고 토마토를 넣어주시면 더욱 맛있는 요리가 완성되죠??
토마토는 그냥 먹는게 아니라 살짝 익혀먹으면 되니까요.
그냥 먹을 수 있는 정도만 주문했어요.
저희는 이렇게 먹고 싶었는데...ㅠㅠ ;ᅲ.ᅮ 그래도 너무"
542,국내제작 1인용 안전 눈썰매 레드/블루 랜덤발송 레드,눈썰매,12510,https://link.coupang.com/a/MEYJP,thumbnail10.coupangcdn.com/thumbnails/remote/230x230ex/image/vendor_inventory/7e41/3f432956281e2f4b38a1e3f4f79bfb423fea0e4ec86efc151333a07b9eec.png,"국내제작 1인용 안전 눈썰매 레드/블루 랜덤발송 레드솔직후기 이벤트도 진행한다.
레드 솔직한 후기 작성 후 블로그에 댓글로 남기면 추첨을 통해 총 100명에게 블루랜턴, 아이패드, 스타벅스 기프티콘 등을 증정할 예정이다.
이벤트 참여는 레드로즈 홈페이지(www.redsoloes.kr)에서 가능하다.</d> 한국토지주택공사(LH)는 지난해 말 기준 전국 미분양 주택은 1만8천9백여가구로 전년보다 1천700여가구 감소했다고 밝혔습니다.
이는 2008년 이후 가장 적은 수치입니다.
지역별로는 수도권이 2천550세대로 전체의 60%를 차지했습니다..
수도권은 960세대로, 전체 물량의 절반 이상을 차지하고 있습니다.
미분양이 줄어든 것은 경기침체로 인한 건설경기 침체가 영향을 미친 것으로 분석됩니다.
특히 수도권에서는 올 들어 신규 분양물량이 크게 줄었음에도 불구하고 지방 중소도시에서 분양한 아파트가 높은 청약"
543,아티나 2인용 어린이 눈썰매 바이올렛,눈썰매,19800,https://link.coupang.com/a/MEYKx,thumbnail7.coupangcdn.com/thumbnails/remote/230x230ex/image/retail/images/2018/12/26/22/6/fd2d9584-3788-4399-a117-03c46d6cfeca.jpg,"아티나 2인용 어린이 눈썰매 바이올렛솔직후기’ 이벤트를 진행한다.
이벤트 참여 방법은 ‘바이올리니스트 김지영’과 함께 찍은 사진을 인스타그램에 업로드하면 된다.
당첨자는 오는 7월 1일 발표된다.
한편 이번 행사는 지난해 12월 31일부터 올 1월 2일까지 진행된 바 있다.
바디프랜드는 “‘아티스트와 동행하는 특별한 시간’을 통해 고객들이 직접 체험하고 즐길 수 있는 기회를 제공하고자 기획했다”며 “이번 행사를 시작으로 앞으로도 다양한 활동을 진행할 예정”이라고 전했다.</d> 한국은행이 기준금리를 연 1.25%로 동결했다.
한은은 9일 금융통화위원회를 열고 이달 금통위에서 만장일치로 금리동결을 결정했다.
이로써 한 달 만에 다시 0.75%포인트 인하됐다.
기준금리인 콜(연 1.50%)보다 낮은 수준이다.
이주열 총재는 이날 기자간담회에서 ""경기회복세가 지속되고 물가상승률이 목표수준으로 안정되는 등 경기회복이 가시화되고"
544,까사드로잉 어린이 눈썰매 - 1 2인용 아기 썰매 유아 갯벌체험,눈썰매,20000,https://link.coupang.com/a/MEYLk,thumbnail6.coupangcdn.com/thumbnails/remote/230x230ex/image/vendor_inventory/1134/c558bdec2572b08916d5b7f56392162d44933bd71db05ef954da2f061d04.jpg,"까사드로잉 어린이 눈썰매 - 1 2인용 아기 썰매 유아 갯벌체험솔직후기
아기 뽀로로 만들기 체험놀이- 2 3 4 5 6 7 8 9 10 11 12 13 14 15 16 18 19 20 21 22 23 24 26 25 27 28 29 30 31 32 33 34 35 36 37 38 39 40 41 44 43 46 42 47 45 48 49 51 52 54 53 56 55 58 57 59 61 62 63 60 64 68 66 67 71 69 72 74 73 77 78 81 76 82 84 83 79 80 88 87 86 85 89 92 91 93 94 96 97 98 99 95 90 103 102 101 104 108 107 106 105 110 109 113 114 120 122 125 115 118 121 116 112 123 124 126 127 128 129 136 131 133 141 143 142 144 152 160 161 162 172 164 166 163 168 171 170 175 174 177 176 173 182 181 183 185 186 184 189 188 1902</d> 2019년 1월 1일, SKT T1의 프로리그 시즌3"
545,HC KC인증 스노우볼메이커/눈뭉치제조기 몰드-눈사람블루,눈썰매,6900,https://link.coupang.com/a/MEYMo,thumbnail7.coupangcdn.com/thumbnails/remote/230x230ex/image/vendor_inventory/b1ef/1d3ffd16ddda8603cc1d6ebd5ada6997fef2c1d3f5f4f70119f3915d3388.jpg,"HC KC인증 스노우볼메이커/눈뭉치제조기 몰드-눈사람블루솔직후기
#스마트폰 <unk>kcnblueshop_official</d> 오늘은 제가 좋아하는 과자 맛집 중 하나인 '에그마요네즈'를 소개해드리려고 합니다.
이번에 소개하는 에그는, 저는 이케아에서 판매하는 제품으로요.
저는 요거트맛과 함께 달콤한 초콜릿을 좋아합니다.
그리고 그 위에 치즈를 올려서 먹습니다.
초콜릿의 향긋한 맛이 입안에서 사르르 녹아서 더욱 고소하고 부드러운 맛을 느낄 수 있습니다.
또한, 초코칩도 같이 들어있어서 더더욱 맛있는 케이크를 만들수 있답니다.
저희는 이렇게 다양한 종류의 제품을 먹어보고 싶었어요.
제가 직접 만든 제품은 아니지만요,
다양한 재료를 사용해서 만들어졌답니다.
특히나 아이스크림이나 음료같은 경우에는 재료 하나하나가 정말 잘 어울려서 좋았어요..
그래서, 이번에도 역시 제"
546,아티나 2인용 어린이 눈썰매 블랙,눈썰매,19800,https://link.coupang.com/a/MEYNf,thumbnail6.coupangcdn.com/thumbnails/remote/230x230ex/image/retail/images/2018/12/26/22/5/c9e20726-33b5-4d10-b056-972915c5abc1.jpg,"아티나 2인용 어린이 눈썰매 블랙솔직후기’ 이벤트를 진행한다.
이번 행사는 오는 31일까지 진행된다.
블랙 솔직한 후기 작성 후 블로그에 댓글을 남기면 추첨을 통해 총 100명에게 ‘아이언맨3D 슈즈’를 증정할 예정이다.
또한 이벤트 기간 동안 매일 선착순 500명에게는 아이언의 정석인 블루투스 스피커와 함께하는 포토타임도 진행할 계획이다.
자세한 내용은 공식 홈페이지(www.blacksolutionkorea.kr)에서 확인할 수 있다.</d> 한국과학기술원(KAIST) 생명화학공학과 김민수 교수팀은 최근 미국 국립과학원회보(PNAS)에 발표한 논문에서 이 같은 사실을 확인했다고 20일 밝혔다.
연구팀의 이번 연구결과는 국제학술지 '네이처 커뮤니케이션스'(Nature Communications)' 최신호에 게재됐다.
김 교수는 ""세포 내 미토콘드리아를 구성하는 단백질 중 하나인 DNA가 암세포의 성장과 발현을 조절하는 역할을 한다는 사실이 밝혀졌"
547,내쇼널 눈썰매 1~2인용 랜덤발송 NSB999,눈썰매,15480,https://link.coupang.com/a/MEYOb,thumbnail8.coupangcdn.com/thumbnails/remote/230x230ex/image/retail/images/2022/01/03/15/9/e1d40f05-38db-490d-9ba0-619dcfa86085.jpg,"내쇼널 눈썰매 1~2인용 랜덤발송 NSB999솔직후기
NHK의 뉴스 프로그램에서 방송된 뉴스를 통해 일본 정부가 독도 영유권을 주장하는 내용을 보도한 적이 있다.
일본 정부는 이 기사를 근거로 한국 정부에 항의서한을 발송했다.
# 그러나 일본은 이를 무시하고 일방적으로 한국의 입장을 대변하였다.
이러자 일본의 우익 언론들은 ""한국에 대한 선전포고""라며 반발하고 나섰다.
이에 대해 한국은 즉각 반박 성명을 발표했다.
2019년 4월, 한겨레신문은 '독도는 우리 땅'이라는 제목의 기사에서 일본이 과거사 문제를 왜곡하여 한일관계를 악화시키고 있다고 주장했다.
기사 내용 중 일부 내용은 다음과 같다.
1. 2018년 3월 15일부터 5월 31일까지 약 2주간 진행된 '한일군사정보보호협정(GSOMIA) 체결을 위한 실무회의'에서 양국은 GSP 협정문 초안을 공개하기로 합의했다고 한다.
2. 2015년 10월 30일에는 양국 국방장관이 공동 기자회견을 열고 “양국 간 군사정보를 공유할 수 있는 협정을 맺기로 했"
548,후니스 눈오리 집게 눈사람 스노우볼 메이커 2개 대형+소형 옐로우 대형1+소형1,눈썰매,7800,https://link.coupang.com/a/MEYO7,thumbnail10.coupangcdn.com/thumbnails/remote/230x230ex/image/vendor_inventory/1086/f5e399fd7bff183d9cd497f8803bfdddc2e200ea6c1671c528e659d448a7.jpg,"후니스 눈오리 집게 눈사람 스노우볼 메이커 2개 대형+소형 옐로우 대형1+소형1솔직후기
#스마트폰 <unk>myLG070_</d> 2017년 12월 31일부터 2020년 1월 1일까지 진행된 이벤트로, 총 4회차에 걸쳐 진행되었으며, 1차는 '2018 S/S 시즌2' 이벤트로 진행되었다.
이벤트 기간 동안 가장 많은 사랑을 받은 캐릭터로는, 미키마우스 ( Mike mouth ), 마법기사 아쿠아맨과 함께한 에피소드인 ""Making the Big Day""가 선정되었다.
또한, 2차에서는 '미스터리 월드: 더 킹 오브 파이터즈'의 최종보스로 등장한다..
2018년 2월 28일에는 유튜브에 공개된 영상이 올라왔다.
영상은 게임 내 스토리에 대한 설명으로 시작한다.
스토리는 다음과 같다.
미키의 친구들 : 이세계에서 온 소녀. 하지만 그건 어디까지나 평범한 일 뿐이야!!
"
549,노르딕 등받이 눈썰매 ND7 블랙 끈 랜덤발송,눈썰매,24560,https://link.coupang.com/a/MEYPY,thumbnail9.coupangcdn.com/thumbnails/remote/230x230ex/image/retail/images/2021/07/29/13/9/eb786be1-a415-42f1-a355-6afd3ca9b8f9.jpg,"노르딕 등받이 눈썰매 ND7 블랙 끈 랜덤발송솔직후기
#NDS <unk>nds.com 에서 다운로드 받을 수 있습니다.</d> 오늘은 제가 좋아하는 과자랑 빵을 먹었어요.
빵이 너무 맛있어서 저는 그냥 먹고 싶었는데...
그냥 먹는게 아니라 진짜로 맛있는거 같아요.
그래서 이번에 또 먹어봤는데 역시나 달달한 맛이였어요!
그리고 그 위에 치즈도 같이 올려져 있어서 정말 좋았답니다.
치즈가 들어간건 처음인데...ᄏᄒ;!??
저는 이렇게 먹으면 더더욱 좋아해요
아무래도 다른 분들은 다들 아시겠지만....ㅠㅠ 
저희는 요렇게 먹을때마다 하나씩씩 나눠먹고 있는데요.^^ ;)
제가 먹은 건데 엄청 잘 익었다고 하네용~♡♥ -
오늘의 포스팅은, 바로 ``오레오칩스 초코쿠키&초콜릿 쿠키와 함께하는 오늘의 아침"
550,퓨어디아 캐치 플라잉 뿅뿅 발달완구 야외 실내 프로펠러 감각 발달 장난감 블루,눈썰매,29800,https://link.coupang.com/a/MEYQT,thumbnail9.coupangcdn.com/thumbnails/remote/230x230ex/image/vendor_inventory/082e/4202fcd2f4906a5989696b3314d1ce8a98247951083c9f8be32085f4eef0.jpg,"퓨어디아 캐치 플라잉 <unk><unk> 발달완구 야외 실내 프로펠러 감각 발달 장난감 블루솔직후기
#블루투스 이어폰으로 놀아요
이제 저도 아이들과 함께 할 수 있는 놀이방놀이방이 생겼네요~!
아이들이 좋아하는 캐릭터들을 직접 만져보고 조립해볼수 있어 좋더라용!</d> 오늘은 제가 제일 먼저 하는게 바로 ``오빠랑 같이 가자고 해서
그냥 오빠가 오라고 해서 갔는데...
그래서 간만에 친구들하고 저녁을 먹으러 왔어요.
저희집엔 항상 동생이 있어서 그런지 동생들도 많이 오고 그랬거든요.
근데 이번에 친구가 너무 많아서 더 편하게 와야겠다 싶어서.ᄏᄒ;)
친구가 엄청 많아서, 그래서 우리집에 오면 꼭 데리고 가야겠다고 생각했어요.
그리고 또 하나 추천하는건 뭐니뭐니가 아니라 진짜 친절하신 분이에요.
바로 그분께서 주신 선물인데요,
제가 정말 좋아했던"
551,엔템 스펀지콩콩이(1+1) 점핑 스카이 스폰지 콩콩 집콕놀이 성장판 자극 아동 실내 체육 스포츠 콩콩이 블루+핑크,눈썰매,15920,https://link.coupang.com/a/MEYR1,thumbnail8.coupangcdn.com/thumbnails/remote/230x230ex/image/vendor_inventory/3d05/064cbaa256d4aae7a32a5224d039532b86cdd028b1709c2d86a2a455b605.jpg,"엔템 스펀지콩콩이(1+1) 점핑 스카이 스폰지 콩콩 집콕놀이 성장판 자극 아동 실내 체육 스포츠 콩콩이 블루+핑크솔직후기 1탄으로 출시됐다.
블루 컬러로 디자인된 핑크는 아이들에게 친근한 느낌을 준다.
또한, 아이들이 좋아하는 캐릭터인 '펭귄'과 함께하는 다양한 놀이 활동을 통해 아이들의 창의력과 상상력을 키워준다.
특히, 뽀로로와 같은 애니메이션을 활용한 어린이 전용 놀이터를 운영해 어린이들이 직접 체험할 수 있는 기회를 제공한다.
아울러 유아용 장난감 및 완구류 등 총 6종의 상품을 선보인다.
유아동용품 전문기업 (주)아이리버는 지난달 30일부터 이 달 1일까지 서울 삼성동 코엑스에서 열린 ‘2017 대한민국 베이비페어’에서 영유아를 위한 키즈 브랜드 ‘아기공룡 둘리(AIGEN BY SLEE)’를 선보였다.
‘두둥실’은 아기들이 가장 좋아하고 선호하는 공룡의 모습을 모티브로 한 제품"
552,아티나 어린이 눈썰매 네이비 S101,눈썰매,21690,https://link.coupang.com/a/MEYSO,thumbnail6.coupangcdn.com/thumbnails/remote/230x230ex/image/retail/images/2019/11/15/14/0/22c301d8-5fb0-4ef2-a2d8-dec484d4e6e9.jpg,"아티나 어린이 눈썰매 네이비 S101솔직후기’를 모집한다.
네이버 블로그(http://blog.naver.khanably/)를 통해 접수하면 된다.
당첨자는 오는 10월 5일 발표된다.
이번 이벤트는 ‘2012 대한민국 퍼스트브랜드 대상’ 수상작과 함께 다양한 경품을 증정하는 이벤트다.
‘대한민국퍼스트의 꿈, 희망의 메시지’라는 주제로 진행되는 이번 행사는 지난해 11월부터 진행돼 온 국민 참여형 행사로 올해는 총 4회차에 걸쳐 진행된다.
특히 이번에 새롭게 선보이는 행사에서는 참가자 전원에게 롯데월드 자유이용권 2매를 제공한다.
또한 추석 연휴 기간 동안 매일 선착순 100명에게 스타벅스 아메리카노 기프티가 제공되며, 당첨의 행운도 누릴 수 있다.
이와 더불어 온라인 퀴즈쇼를 통한 푸짐하고 풍성한 선물까지 준비되어 있어 많은 이들의 관심을 모으고 있다.</d> 한국은행이 기준금리를 동결했다.
한은"
553,아티나 2인용 어린이 눈썰매 블랙,눈썰매,19800,https://link.coupang.com/a/MEYTL,thumbnail6.coupangcdn.com/thumbnails/remote/230x230ex/image/retail/images/2018/12/26/22/5/c9e20726-33b5-4d10-b056-972915c5abc1.jpg,"아티나 2인용 어린이 눈썰매 블랙솔직후기’ 이벤트를 진행한다.
이번 행사는 오는 31일까지 진행된다.
블랙 솔직한 후기 작성 후 블로그에 댓글을 남기면 추첨을 통해 총 100명에게 ‘아이언맨3D 슈즈’를 증정할 예정이다.
또한 이벤트 기간 동안 매일 선착순 500명에게는 아이언의 정석인 블루투스 스피커와 함께하는 포토타임도 진행할 계획이다.
자세한 내용은 공식 홈페이지(www.blacksolutionkorea.kr)에서 확인할 수 있다.</d> 한국과학기술원(KAIST) 생명화학공학과 김민수 교수팀은 최근 미국 국립과학원회보(PNAS)에 발표한 논문에서 이 같은 사실을 확인했다고 20일 밝혔다.
연구팀의 이번 연구결과는 국제학술지 '네이처 커뮤니케이션스'(Nature Communications)' 최신호에 게재됐다.
김 교수는 ""세포 내 미토콘드리아를 구성하는 단백질 중 하나인 DNA가 암세포의 성장과 발현을 조절하는 역할을 한다는 사실이 밝혀졌"
554,아티나 2인용 어린이 눈썰매 바이올렛,눈썰매,19800,https://link.coupang.com/a/MEYUE,thumbnail7.coupangcdn.com/thumbnails/remote/230x230ex/image/retail/images/2018/12/26/22/6/fd2d9584-3788-4399-a117-03c46d6cfeca.jpg,"아티나 2인용 어린이 눈썰매 바이올렛솔직후기’ 이벤트를 진행한다.
이벤트 참여 방법은 ‘바이올리니스트 김지영’과 함께 찍은 사진을 인스타그램에 업로드하면 된다.
당첨자는 오는 7월 1일 발표된다.
한편 이번 행사는 지난해 12월 31일부터 올 1월 2일까지 진행된 바 있다.
바디프랜드는 “‘아티스트와 동행하는 특별한 시간’을 통해 고객들이 직접 체험하고 즐길 수 있는 기회를 제공하고자 기획했다”며 “이번 행사를 시작으로 앞으로도 다양한 활동을 진행할 예정”이라고 전했다.</d> 한국은행이 기준금리를 연 1.25%로 동결했다.
한은은 9일 금융통화위원회를 열고 이달 금통위에서 만장일치로 금리동결을 결정했다.
이로써 한 달 만에 다시 0.75%포인트 인하됐다.
기준금리인 콜(연 1.50%)보다 낮은 수준이다.
이주열 총재는 이날 기자간담회에서 ""경기회복세가 지속되고 물가상승률이 목표수준으로 안정되는 등 경기회복이 가시화되고"
555,아티나 2인용 어린이 눈썰매 레드,눈썰매,19800,https://link.coupang.com/a/MEYVw,thumbnail7.coupangcdn.com/thumbnails/remote/230x230ex/image/retail/images/2018/12/26/22/4/c8255772-7ba8-4d2e-9218-3d9d5b5b7757.jpg,"아티나 2인용 어린이 눈썰매 레드솔직후기’ 이벤트를 진행한다.
이번 행사는 오는 31일까지 진행된다.
레드 솔직한 후기 작성 후 이벤트 페이지에 댓글을 남기면 추첨을 통해 총 100명에게 ‘아이언맨3D 슈즈’를 증정할 예정이다.
당일 당일에는 레드와 블루, 핑크 등 3가지 색상으로 구성된 아이언을 선착순 500명 한정으로 판매하며, 구매 고객에게는 블랙과 화이트 색상 중 하나를 선택할 수 있는 기회를 제공한다.
또한 행사 기간 동안 매일 오전 10시부터 오후 5시까지 진행되는 체험존에서는 다양한 체험을 할 수도 있다.
체험존의 경우 참가자 전원에게 닌텐도 스위치 게임기 Wii, 미니게임기, 스킨케어 세트, 에코백 등을 제공한다.</d> 한국은행이 기준금리를 연 1.25%로 동결했다.
한은은 지난달 30일 금융통화위원회를 열고 이 같은 내용의 '2019년 6월 통화정책방향'을 의결했다고 밝혔다.
지난해 11월 이후 7개월 만에 금리가 인하"
556,리빙웜 오리모양 눈 집게 모래집게 옐로우 4p,눈썰매,13900,https://link.coupang.com/a/MEYWi,thumbnail8.coupangcdn.com/thumbnails/remote/230x230ex/image/retail/images/2021/02/09/13/3/36ec6554-e87e-440b-89f8-7713ddd1a821.jpg,"리빙웜 오리모양 눈 집게 모래집게 옐로우 4p솔직후기
#눈 뽀로로와이즈캣<unk></d> 오늘은 제가 좋아하는 과자랑 빵을 먹으러 갔는데요.
저는 이번에 처음 먹어보는 과일빵인데요,
그냥 그냥 평범한 맛이었어요.
그래서 저는 그걸 먹고 싶었거든요!
그리고 바로 옆에 있는 딸기잼도 있었어요
딸기쨈과 함께 먹으면 더 맛있는 것 같아서
아무튼 딸기가 들어간 음료였답니다.
저희는 바나나맛 우유, 그리고 바나나를 주문했답니다!^^ 
바나나맛이 너무 좋아서 정말 좋아했는데...
생각보다 엄청 달달해서 아이들도 먹기 딱 좋은 맛이더라구요.ᄒᄏ;)
아이들 간식으로 많이 드시는 분들은 꼭 챙겨드시면 좋을것 같네용~♡♥ -
오늘의 포스팅은, ``과일젤리&초코칩스틱><>
제가 선택한 제품은 초콜렛"
557,아티나 2인용 어린이 눈썰매 네이비,눈썰매,19800,https://link.coupang.com/a/MEYXf,thumbnail6.coupangcdn.com/thumbnails/remote/230x230ex/image/retail/images/2019/11/15/16/5/177ee869-11da-4f04-8649-6431be0adaeb.jpg,"아티나 2인용 어린이 눈썰매 네이비솔직후기 이벤트도 진행한다.
이벤트 참여 방법은 간단하다.
네이버 카페에 ‘눈치우세요’ 댓글을 달면 된다.
추첨을 통해 총 100명에게 아이패드 미니(1명), 닌텐도, 영화예매, 기프티, 커피교환권 등 다양한 경품을 제공한다.
또한 추석 연휴 기간 동안 매일 선착순 500명에게는 모바일 상품권을 증정할 예정이다.
자세한 내용은 공식 홈페이지(www.naverafekorea.kr)에서 확인할 수 있다.</d> 한국투자증권은 오는 30일까지 '2012 KOSPI200-HSCEFT-미국달러선물 ELS'를 판매한다고 밝혔다.
KOSDAQ 200지수를 기초 자산으로 하는 이 상품의 1년 만기 6개월 단위 조기상환형 스텝다운 구조로 3년 만기에 최고 12%(연 6.2%) 수익을 지급하며, 상환조건은 최초기준가격의 90%(6개월), 85%, 80%(12"
558,팡팡 휴대용 썰매 블루 + 레드 세트,눈썰매,7900,https://link.coupang.com/a/MEYX7,thumbnail9.coupangcdn.com/thumbnails/remote/230x230ex/image/retail/images/979770887546156-bfe08200-f726-4852-9632-dfd7ec1ea983.jpg,"팡팡 휴대용 썰매 블루 + 레드 세트솔직후기
#블루레드세트는 처음 먹어봤는데 너무 맛있어서 그냥 먹었어요
이렇게 맛있는게 다 있나 싶었는데...
그냥 먹는거라서 그런지 진짜 잘 안먹더라고요~!
그리고 저는 블랙베리랑 같이 먹으면 더 좋겠다 싶어서
바로 주문했습니다
저는 화이트와인을 좋아해서 제가 좋아하는 레드와인이라 선택했는데요.
제가 선택한 이유는 바로 핑크색이에요.
핑크는 정말 달달하고 부드러운 맛이 나거든요?
그래도 이걸로 먹고싶은 분들은 꼭 드셔보시면 좋을 것 같아용!</d> 오늘 아침부터 저녁까지 고민이 많았습니다.
오늘 하루종일 피곤한 기분이었어요.
아침 일찍 일어나니 몸이 많이 지쳤고 아침에 일어나자마자 잠들기 힘들었던 기억들이 떠올랐네요.ᄒ;)
어제 저녁에 먹은 음식들을 다시 한 번 생각해봅니다.
`오랜만에 만난"
559,오리 스노우볼 메이커 눈썰매 4종세트,눈썰매,12900,https://link.coupang.com/a/MEYYV,thumbnail7.coupangcdn.com/thumbnails/remote/230x230ex/image/retail/images/4986536739588064-7e0c507f-4c38-47a9-b767-66bdb81662fa.jpg,"오리 스노우볼 메이커 눈썰매 4종세트솔직후기
#눈꽃빙수 <unk>korea.kr</d> 오늘은 제가 좋아하는 과자랑 빵을 먹으러 갔는데요.
이번엔 저의 친구들이 만든 수제빵과 함께한 샌드위치였어요.
저는 이번에 처음 먹어보는 제게 젤 맛있었어요!
제가 직접 만들어본 건데요,
그냥 그냥 먹는 게 아니라 진짜로 달달하고 고소해서 좋았답니다.
그리고 그 위에 크림치즈도 같이 올려져 있었구요
크림 치즈는 정말 부드럽고 촉촉했어요.
그래서 너무 좋아하시는 분들께는 추천할만한 메뉴라고 생각했습니다.
저희는 개인적으로 크림을 많이 먹고 싶어서 선택한 거라서
아무래도 다른 디너에 비해 좀 더 부드러운 맛이 느껴졌거든요..
하지만 이렇게 맛있는 케이크를 먹을 수 있는 곳은 없었답니다!ᄒᄏ.ᅲᅮㅠㅠ 
제 입맛에는 딱 맞는 것 같아서,,"
